"Enrichment FDR","nGenes","Pathway Genes","Fold Enrichment","Pathway","URL","Genes"
0.038370472710445,90,196,1.31366669890705,"Organelle assembly "," http://amigo.geneontology.org/amigo/term/GO:0070925","AT1G03780 AT1G14320 AT1G15440 AT1G16740 AT1G18540 AT1G20110 AT1G21190 AT1G26910 AT1G29430 AT1G32990 AT1G43860 AT1G50710 AT1G52930 AT1G61030 AT1G61580 AT1G67440 AT1G72370 AT1G73790 AT1G74050 AT1G74060 AT1G76860 AT1G79090 AT2G07725 AT2G20616 AT2G24070 AT2G31260 AT2G34380 AT2G36620 AT2G37190 AT2G37270 AT2G39460 AT2G39820 AT2G40010 AT2G40430 AT2G40810 AT2G41350 AT2G42740 AT2G44190 AT2G44860 AT2G45710 AT2G45810 AT3G01015 AT3G02080 AT3G06320 AT3G07525 AT3G11250 AT3G13672 AT3G14100 AT3G15460 AT3G22270 AT3G22980 AT3G24506 AT3G53020 AT3G53760 AT3G56440 AT3G56510 AT3G61110 AT3G61240 AT4G00660 AT4G01310 AT4G05190 AT4G15770 AT4G19360 AT4G21270 AT4G22150 AT4G25190 AT4G30790 AT5G03830 AT5G06680 AT5G07170 AT5G15510 AT5G15520 AT5G16460 AT5G17290 AT5G17410 AT5G17620 AT5G38720 AT5G38880 AT5G41520 AT5G43160 AT5G44270 AT5G49540 AT5G50230 AT5G52650 AT5G54920 AT5G61010 AT5G61500 AT5G61770 AT5G62240 ATCG00840"
0.0392201011066996,77,164,1.34321529945157,"Non-membrane-bounded organelle assembly "," http://amigo.geneontology.org/amigo/term/GO:0140694","AT1G03780 AT1G14320 AT1G15440 AT1G16740 AT1G18540 AT1G21190 AT1G26910 AT1G29430 AT1G32990 AT1G43860 AT1G50710 AT1G52930 AT1G61030 AT1G61580 AT1G67440 AT1G72370 AT1G73790 AT1G74050 AT1G74060 AT1G76860 AT1G79090 AT2G07725 AT2G20616 AT2G24070 AT2G34380 AT2G36620 AT2G37190 AT2G37270 AT2G39460 AT2G39820 AT2G40010 AT2G40430 AT2G41350 AT2G42740 AT2G44190 AT2G44860 AT2G45710 AT2G45810 AT3G01015 AT3G02080 AT3G06320 AT3G11250 AT3G14100 AT3G15460 AT3G22270 AT3G22980 AT3G24506 AT3G53020 AT3G53760 AT3G56510 AT3G61110 AT3G61240 AT4G00660 AT4G01310 AT4G05190 AT4G15770 AT4G19360 AT4G21270 AT4G25190 AT5G03830 AT5G06680 AT5G07170 AT5G15510 AT5G15520 AT5G16460 AT5G17410 AT5G17620 AT5G38720 AT5G38880 AT5G41520 AT5G43160 AT5G44270 AT5G52650 AT5G54920 AT5G61770 AT5G62240 ATCG00840"
0.0411729535410829,91,199,1.30823893030185,"Pigment metabolic process "," http://amigo.geneontology.org/amigo/term/GO:0042440","AT1G03475 AT1G03630 AT1G06000 AT1G06820 AT1G08450 AT1G10670 AT1G19670 AT1G20780 AT1G27320 AT1G27450 AT1G28100 AT1G31800 AT1G44446 AT1G49530 AT1G49540 AT1G53500 AT1G63970 AT1G64520 AT1G69720 AT1G69740 AT1G71220 AT1G71750 AT1G74470 AT1G78570 AT2G20180 AT2G20890 AT2G26170 AT2G31250 AT2G32950 AT2G35260 AT2G41680 AT2G43000 AT3G02780 AT3G03890 AT3G04870 AT3G10230 AT3G11220 AT3G14110 AT3G14790 AT3G16857 AT3G19290 AT3G21200 AT3G21500 AT3G51820 AT3G53130 AT3G56940 AT3G58110 AT3G59400 AT3G62610 AT4G01660 AT4G01690 AT4G01900 AT4G03240 AT4G14090 AT4G14210 AT4G16690 AT4G17600 AT4G18480 AT4G22260 AT4G22880 AT4G22920 AT4G25080 AT4G27440 AT4G34135 AT4G34740 AT4G36810 AT4G38880 AT5G05860 AT5G08280 AT5G08640 AT5G13630 AT5G13680 AT5G13800 AT5G13930 AT5G17220 AT5G17230 AT5G26030 AT5G40850 AT5G42800 AT5G43430 AT5G43860 AT5G45930 AT5G47110 AT5G49650 AT5G52570 AT5G54060 AT5G58250 AT5G58270 AT5G61230 AT5G61670 AT5G64460"
0.0411729535410829,24,40,1.71652448657188,"Ribosomal large subunit assembly "," http://amigo.geneontology.org/amigo/term/GO:0000027","AT1G14320 AT1G16740 AT1G18540 AT1G26910 AT1G32990 AT1G52930 AT1G61580 AT1G74050 AT1G74060 AT2G07725 AT2G36620 AT2G37190 AT2G39460 AT2G40010 AT2G40430 AT2G42740 AT2G44860 AT3G06320 AT3G11250 AT3G15460 AT3G53020 AT4G01310 AT5G61770 ATCG00840"
0.0435952540170181,23,38,1.73158171891023,"Regulation of alternative mRNA splicing, via spliceosome "," http://amigo.geneontology.org/amigo/term/GO:0000381","AT1G09140 AT1G30480 AT1G79100 AT2G27100 AT2G37340 AT2G38610 AT2G46610 AT3G01150 AT3G08620 AT3G09160 AT3G13570 AT3G32940 AT3G53500 AT3G61860 AT4G11970 AT4G20030 AT4G24500 AT4G25500 AT4G26480 AT5G05720 AT5G52040 AT5G56140 AT5G64200"
0.0439323513832356,33,60,1.57348077935756,"Mitochondrial RNA metabolic process "," http://amigo.geneontology.org/amigo/term/GO:0000959","AT1G06140 AT1G12300 AT1G15480 AT1G29880 AT1G30010 AT1G68990 AT1G74230 AT1G74600 AT2G20540 AT2G46050 AT3G02330 AT3G05240 AT3G06790 AT3G12770 AT3G13880 AT3G16010 AT3G16260 AT3G18970 AT3G20930 AT3G44740 AT4G01400 AT4G11690 AT4G14790 AT4G20020 AT5G04050 AT5G08490 AT5G15700 AT5G44780 AT5G46920 AT5G47680 AT5G54180 AT5G54580 AT5G61030"
0.0444492533915412,46,90,1.46222456263531,"Regulation of DNA metabolic process "," http://amigo.geneontology.org/amigo/term/GO:0051052","AT1G06760 AT1G08390 AT1G09320 AT1G20870 AT1G24290 AT1G28060 AT1G49540 AT1G52740 AT1G54230 AT1G54840 AT1G54850 AT1G65070 AT1G75950 AT1G76440 AT1G79950 AT2G05210 AT2G20330 AT2G30620 AT2G35320 AT2G38810 AT3G01610 AT3G06290 AT3G12290 AT3G13226 AT3G14980 AT3G15605 AT3G16730 AT3G22680 AT3G24495 AT3G48710 AT3G49180 AT3G54710 AT3G57300 AT4G02720 AT4G29860 AT5G06310 AT5G08780 AT5G13130 AT5G40820 AT5G52950 AT5G54090 AT5G58130 AT5G62760 AT5G63550 AT5G63950 AT5G66130"
0.0451904457237308,22,36,1.74831197706395,"Positive regulation of translation "," http://amigo.geneontology.org/amigo/term/GO:0045727","AT1G10840 AT1G15870 AT1G26630 AT1G33980 AT1G71720 AT1G74310 AT1G80720 AT2G18720 AT2G39790 AT2G39795 AT2G41600 AT2G46190 AT3G46610 AT3G55605 AT3G63140 AT4G38090 AT5G02050 AT5G05990 AT5G08650 AT5G09920 AT5G39930 AT5G51220"
0.0486783570498375,191,457,1.19568262923132,"Cellular amino acid metabolic process "," http://amigo.geneontology.org/amigo/term/GO:0006520","AT1G03090 AT1G06550 AT1G06570 AT1G07780 AT1G08250 AT1G08490 AT1G08630 AT1G09620 AT1G09795 AT1G10070 AT1G11790 AT1G14810 AT1G15040 AT1G15710 AT1G16460 AT1G17745 AT1G17960 AT1G18640 AT1G22020 AT1G24807 AT1G25350 AT1G29410 AT1G29880 AT1G30010 AT1G31180 AT1G31230 AT1G31860 AT1G32470 AT1G32640 AT1G48850 AT1G49820 AT1G51720 AT1G52340 AT1G55510 AT1G55880 AT1G55920 AT1G62180 AT1G62800 AT1G62960 AT1G64660 AT1G65860 AT1G65960 AT1G68420 AT1G69370 AT1G71170 AT1G71180 AT1G72330 AT1G72810 AT1G72990 AT1G74040 AT1G75180 AT1G75330 AT1G79440 AT1G79900 AT1G80555 AT1G80560 AT2G02390 AT2G02765 AT2G04400 AT2G04842 AT2G17640 AT2G19940 AT2G21940 AT2G22250 AT2G25840 AT2G27450 AT2G30970 AT2G31810 AT2G33840 AT2G35370 AT2G36230 AT2G37250 AT2G37500 AT2G39800 AT2G43000 AT2G43400 AT2G43750 AT2G43840 AT2G44040 AT3G02020 AT3G03630 AT3G03910 AT3G05190 AT3G07630 AT3G12670 AT3G13450 AT3G13490 AT3G16050 AT3G17390 AT3G17760 AT3G17810 AT3G19480 AT3G19710 AT3G20390 AT3G22200 AT3G22425 AT3G24360 AT3G27740 AT3G44740 AT3G46100 AT3G47340 AT3G53180 AT3G53580 AT3G55400 AT3G55610 AT3G55840 AT3G56300 AT3G56310 AT3G57060 AT3G57560 AT3G58140 AT3G58610 AT3G58990 AT3G59410 AT3G59970 AT3G60510 AT3G62030 AT3G62120 AT3G62130 AT3G63250 AT4G01900 AT4G02120 AT4G02610 AT4G04350 AT4G04610 AT4G08040 AT4G13360 AT4G14710 AT4G14880 AT4G17300 AT4G17830 AT4G20930 AT4G21990 AT4G26300 AT4G26870 AT4G26900 AT4G26910 AT4G29120 AT4G29840 AT4G30550 AT4G31810 AT4G32520 AT4G33010 AT4G33510 AT4G33680 AT4G34020 AT4G34410 AT4G34740 AT4G34840 AT4G35630 AT4G35640 AT4G37670 AT4G38225 AT4G38800 AT4G38880 AT4G39540 AT4G39940 AT5G03406 AT5G04120 AT5G04140 AT5G05590 AT5G05730 AT5G09300 AT5G10870 AT5G10880 AT5G11880 AT5G12860 AT5G13280 AT5G14200 AT5G16290 AT5G20980 AT5G26710 AT5G27410 AT5G27470 AT5G34930 AT5G38530 AT5G43430 AT5G48220 AT5G49030 AT5G51690 AT5G52100 AT5G53850 AT5G54080 AT5G57850 AT5G60540 AT5G62530 AT5G63890 AT5G64370 AT5G65940 AT5G66120 AT5G67520"
0.0489081072678508,27,47,1.64348089139861,"Alternative mRNA splicing, via spliceosome "," http://amigo.geneontology.org/amigo/term/GO:0000380","AT1G03140 AT1G09140 AT1G30480 AT1G79100 AT1G80070 AT2G27100 AT2G37340 AT2G38610 AT2G39340 AT2G46610 AT3G01150 AT3G08620 AT3G09160 AT3G13570 AT3G32940 AT3G53500 AT3G61860 AT4G11970 AT4G20030 AT4G24500 AT4G25500 AT4G26480 AT5G05720 AT5G52040 AT5G56140 AT5G58020 AT5G64200"
0.0495785572141859,104,233,1.27695669959568,"Histone modification "," http://amigo.geneontology.org/amigo/term/GO:0016570","AT1G02740 AT1G04020 AT1G04950 AT1G08460 AT1G08620 AT1G09060 AT1G09320 AT1G09450 AT1G10450 AT1G14350 AT1G14400 AT1G22950 AT1G26470 AT1G30810 AT1G49540 AT1G54140 AT1G54360 AT1G54840 AT1G73100 AT1G73910 AT1G76540 AT1G77300 AT1G77540 AT2G02760 AT2G16390 AT2G17900 AT2G19640 AT2G20330 AT2G22740 AT2G23380 AT2G23740 AT2G25880 AT2G31600 AT2G35160 AT2G35320 AT2G40020 AT2G42940 AT2G44150 AT2G46040 AT2G47210 AT3G01320 AT3G01460 AT3G02980 AT3G03750 AT3G06820 AT3G07610 AT3G07740 AT3G09670 AT3G10390 AT3G13670 AT3G14980 AT3G15605 AT3G20740 AT3G21820 AT3G22590 AT3G24870 AT3G24880 AT3G27460 AT3G44490 AT3G44600 AT3G44660 AT3G44750 AT3G49400 AT3G52030 AT3G52250 AT3G53860 AT3G59960 AT4G00830 AT4G00990 AT4G14385 AT4G16420 AT4G17410 AT4G18470 AT4G20400 AT4G28190 AT4G29830 AT4G31120 AT4G32830 AT5G04240 AT5G04670 AT5G08450 AT5G09230 AT5G11340 AT5G13530 AT5G13960 AT5G18190 AT5G22010 AT5G22330 AT5G22650 AT5G24330 AT5G26040 AT5G27650 AT5G43990 AT5G49020 AT5G52470 AT5G52490 AT5G53430 AT5G57380 AT5G58575 AT5G61150 AT5G62540 AT5G63080 AT5G64610 AT5G67320"
0.0499201161428523,8,9,2.54299923936575,"Peptidyl-methionine modification "," http://amigo.geneontology.org/amigo/term/GO:0018206","AT1G03150 AT1G15390 AT1G80410 AT2G11000 AT2G38130 AT3G02980 AT5G14660 AT5G58450"
0.0506801546299862,19,30,1.8118869580481,"Mitochondrial RNA modification "," http://amigo.geneontology.org/amigo/term/GO:1900864","AT1G06140 AT1G15480 AT1G74230 AT1G74600 AT2G20540 AT2G46050 AT3G02330 AT3G05240 AT3G06790 AT3G12770 AT3G13880 AT3G18970 AT3G20930 AT4G11690 AT4G20020 AT5G08490 AT5G44780 AT5G54580 AT5G61030"
0.0514030403266199,26,45,1.65294950558774,"Negative regulation of cell cycle phase transition "," http://amigo.geneontology.org/amigo/term/GO:1901988","AT1G02970 AT1G52530 AT1G77320 AT1G77620 AT1G80710 AT2G19270 AT2G20635 AT2G29680 AT2G32900 AT2G33560 AT3G02680 AT3G12280 AT3G19590 AT3G25980 AT3G54710 AT4G12620 AT4G14700 AT4G17760 AT4G29860 AT5G05510 AT5G39770 AT5G40820 AT5G49880 AT5G52910 AT5G52950 AT5G66130"
0.0526433710287623,16,24,1.90724942952431,"SnRNA metabolic process "," http://amigo.geneontology.org/amigo/term/GO:0016073","AT1G03360 AT1G60080 AT1G61010 AT2G01730 AT2G20490 AT2G32415 AT3G07530 AT3G07750 AT3G12990 AT3G46210 AT3G60500 AT3G61620 AT4G27490 AT4G32175 AT5G51130 AT5G51170"
0.0526433710287623,15,22,1.95059600746805,"Regulation of mitotic metaphase/anaphase transition "," http://amigo.geneontology.org/amigo/term/GO:0030071","AT1G06590 AT1G50490 AT1G78770 AT2G20635 AT2G32900 AT2G33560 AT2G39090 AT3G05870 AT3G16320 AT3G19590 AT3G25980 AT3G48150 AT4G21530 AT5G05510 AT5G49880"
0.0526433710287623,17,26,1.87057155587961,"Negative regulation of mitotic cell cycle phase transition "," http://amigo.geneontology.org/amigo/term/GO:1901991","AT1G52530 AT1G77320 AT1G77620 AT2G20635 AT2G29680 AT2G32900 AT2G33560 AT3G02680 AT3G12280 AT3G19590 AT3G25980 AT4G12620 AT4G14700 AT5G05510 AT5G49880 AT5G52950 AT5G66130"
0.0526433710287623,15,22,1.95059600746805,"Regulation of metaphase/anaphase transition of cell cycle "," http://amigo.geneontology.org/amigo/term/GO:1902099","AT1G06590 AT1G50490 AT1G78770 AT2G20635 AT2G32900 AT2G33560 AT2G39090 AT3G05870 AT3G16320 AT3G19590 AT3G25980 AT3G48150 AT4G21530 AT5G05510 AT5G49880"
0.0532904778146612,68,144,1.35096834591305,"Chromosome segregation "," http://amigo.geneontology.org/amigo/term/GO:0007059","AT1G01690 AT1G06590 AT1G08390 AT1G13330 AT1G22260 AT1G48360 AT1G50490 AT1G53490 AT1G61030 AT1G63990 AT1G64960 AT1G67370 AT1G68310 AT1G75950 AT1G78770 AT1G79890 AT2G20635 AT2G24970 AT2G32590 AT2G32900 AT2G33560 AT2G39090 AT2G47980 AT3G02980 AT3G05870 AT3G08880 AT3G10440 AT3G12280 AT3G16320 AT3G16730 AT3G19590 AT3G25980 AT3G27730 AT3G48150 AT3G57060 AT3G61650 AT3G63480 AT4G05360 AT4G15890 AT4G17380 AT4G19350 AT4G21530 AT4G38560 AT5G03470 AT5G04320 AT5G05490 AT5G05510 AT5G05560 AT5G05620 AT5G06590 AT5G07590 AT5G07660 AT5G11340 AT5G12360 AT5G20930 AT5G22010 AT5G37630 AT5G39770 AT5G41150 AT5G42190 AT5G47690 AT5G49880 AT5G52220 AT5G52290 AT5G61460 AT5G63540 AT5G63920 AT5G67560"
0.0562434344803522,76,164,1.32577094491324,"Meiotic cell cycle process "," http://amigo.geneontology.org/amigo/term/GO:1903046","AT1G01690 AT1G02065 AT1G04030 AT1G06660 AT1G07060 AT1G07745 AT1G13330 AT1G14350 AT1G20750 AT1G22260 AT1G31810 AT1G34210 AT1G48360 AT1G50240 AT1G52530 AT1G53490 AT1G60460 AT1G61030 AT1G63990 AT1G65010 AT1G67370 AT1G77320 AT2G20635 AT2G30820 AT2G31970 AT2G33400 AT2G33560 AT2G33640 AT2G33793 AT2G36850 AT2G41420 AT2G47980 AT3G02680 AT3G02930 AT3G07160 AT3G09660 AT3G10440 AT3G12280 AT3G16730 AT3G19210 AT3G24495 AT3G27730 AT3G57060 AT3G61650 AT3G63480 AT4G01370 AT4G05360 AT4G14180 AT4G15890 AT4G17380 AT4G20900 AT4G21270 AT4G21820 AT4G25540 AT4G27595 AT4G32190 AT4G35520 AT5G02820 AT5G03470 AT5G04320 AT5G05490 AT5G05510 AT5G05620 AT5G12360 AT5G18700 AT5G22010 AT5G39770 AT5G41150 AT5G44040 AT5G46700 AT5G47690 AT5G52290 AT5G56580 AT5G63540 AT5G63920 AT5G66030"
0.0586630599619877,45,89,1.44650939879653,"Chlorophyll metabolic process "," http://amigo.geneontology.org/amigo/term/GO:0015994","AT1G03475 AT1G03630 AT1G08550 AT1G10670 AT1G19670 AT1G20780 AT1G27320 AT1G44446 AT1G63970 AT1G69740 AT1G74470 AT2G20180 AT2G20890 AT2G31250 AT2G35260 AT2G41680 AT3G01910 AT3G02780 AT3G14110 AT3G16857 AT3G19290 AT3G21200 AT3G21500 AT3G51820 AT3G56940 AT3G59400 AT4G01660 AT4G01690 AT4G16690 AT4G17600 AT4G18480 AT4G22920 AT4G25080 AT4G27440 AT5G08280 AT5G13630 AT5G13800 AT5G38520 AT5G40850 AT5G43430 AT5G43860 AT5G45930 AT5G47110 AT5G58250 AT5G58270"
0.0600092539995681,6,6,2.86087414428647,"Leading strand elongation "," http://amigo.geneontology.org/amigo/term/GO:0006272","AT1G07370 AT1G08260 AT2G27120 AT2G27470 AT2G29570 AT5G67100"
0.0600092539995681,6,6,2.86087414428647,"Negative regulation of mRNA metabolic process "," http://amigo.geneontology.org/amigo/term/GO:1903312","AT2G17975 AT2G22090 AT2G24350 AT3G12640 AT3G56860 AT4G34830"
0.0621094668136998,52,106,1.40344769342355,"Tetrapyrrole metabolic process "," http://amigo.geneontology.org/amigo/term/GO:0033013","AT1G03475 AT1G03630 AT1G08550 AT1G10670 AT1G19670 AT1G20780 AT1G27320 AT1G44446 AT1G63970 AT1G69720 AT1G69740 AT1G74470 AT2G20180 AT2G20890 AT2G31250 AT2G35260 AT2G41680 AT3G01910 AT3G02780 AT3G03890 AT3G09150 AT3G14110 AT3G16857 AT3G19290 AT3G21200 AT3G21500 AT3G51820 AT3G56940 AT3G59400 AT4G01660 AT4G01690 AT4G03240 AT4G16690 AT4G17600 AT4G18480 AT4G22920 AT4G25080 AT4G27440 AT5G08280 AT5G13630 AT5G13800 AT5G26030 AT5G38520 AT5G40850 AT5G43430 AT5G43860 AT5G45930 AT5G47110 AT5G58250 AT5G58270 AT5G63290 AT5G64460"
0.0621094668136998,173,413,1.19838069482218,"Organophosphate biosynthetic process "," http://amigo.geneontology.org/amigo/term/GO:0090407","AT1G01460 AT1G09430 AT1G10670 AT1G11880 AT1G12640 AT1G15700 AT1G16040 AT1G16350 AT1G16560 AT1G20400 AT1G20575 AT1G21640 AT1G22620 AT1G22940 AT1G27450 AT1G28960 AT1G29880 AT1G30120 AT1G31190 AT1G31220 AT1G31910 AT1G49530 AT1G51650 AT1G53710 AT1G54130 AT1G55090 AT1G59900 AT1G62580 AT1G63970 AT1G71010 AT1G71750 AT1G72040 AT1G74320 AT1G75020 AT1G78900 AT1G79470 AT1G80860 AT1G80950 AT2G01350 AT2G01690 AT2G02500 AT2G07707 AT2G16370 AT2G19680 AT2G22230 AT2G22240 AT2G22530 AT2G26830 AT2G26930 AT2G27340 AT2G27490 AT2G29630 AT2G31955 AT2G33040 AT2G35040 AT2G35390 AT2G35680 AT2G37250 AT2G37690 AT2G38040 AT2G39270 AT2G39290 AT2G40850 AT2G41490 AT2G43760 AT2G43980 AT2G44750 AT3G01390 AT3G01820 AT3G02780 AT3G05630 AT3G06650 AT3G07140 AT3G07180 AT3G09560 AT3G12670 AT3G14270 AT3G16050 AT3G16990 AT3G18680 AT3G18850 AT3G21070 AT3G21110 AT3G21500 AT3G21530 AT3G23580 AT3G25860 AT3G27240 AT3G27740 AT3G45040 AT3G45740 AT3G46940 AT3G47450 AT3G54250 AT3G55030 AT3G56960 AT3G57220 AT3G57610 AT3G58130 AT3G60190 AT4G00895 AT4G02120 AT4G04320 AT4G04870 AT4G05210 AT4G09760 AT4G10100 AT4G11010 AT4G13830 AT4G14850 AT4G16700 AT4G17190 AT4G17360 AT4G21470 AT4G22340 AT4G22930 AT4G23895 AT4G24500 AT4G26510 AT4G26770 AT4G29480 AT4G29530 AT4G32180 AT4G34350 AT4G34570 AT4G34740 AT4G35360 AT4G35530 AT4G36810 AT4G36940 AT4G38570 AT4G38880 AT4G39180 AT5G03300 AT5G03430 AT5G07370 AT5G08340 AT5G08670 AT5G08680 AT5G10160 AT5G10170 AT5G14760 AT5G14850 AT5G15070 AT5G16760 AT5G20990 AT5G21050 AT5G22130 AT5G23070 AT5G24240 AT5G27450 AT5G35360 AT5G40810 AT5G42810 AT5G44750 AT5G45940 AT5G46850 AT5G47435 AT5G47770 AT5G47840 AT5G50850 AT5G55130 AT5G55810 AT5G56610 AT5G58270 AT5G59500 AT5G60540 AT5G60620 AT5G61760 AT5G62790 AT5G63310 ATCG00480 ATMG00040"
0.0632175878272009,41,80,1.46619799894681,"RNA 3 -end processing "," http://amigo.geneontology.org/amigo/term/GO:0031123","AT1G01210 AT1G03360 AT1G17760 AT1G17980 AT1G22660 AT1G59760 AT1G60080 AT1G61010 AT1G66500 AT1G71800 AT1G73840 AT1G74700 AT2G04530 AT2G24350 AT2G25850 AT2G32415 AT2G39740 AT2G43410 AT3G07750 AT3G12640 AT3G12990 AT3G16260 AT3G22590 AT3G45750 AT3G46210 AT3G50100 AT3G60500 AT3G61620 AT4G14790 AT4G25550 AT4G27490 AT4G29820 AT4G32175 AT5G02670 AT5G09920 AT5G10060 AT5G39930 AT5G51170 AT5G51660 AT5G52470 AT5G52490"
0.0632175878272009,22,37,1.70106030200817,"Positive regulation of cellular amide metabolic process "," http://amigo.geneontology.org/amigo/term/GO:0034250","AT1G10840 AT1G15870 AT1G26630 AT1G33980 AT1G71720 AT1G74310 AT1G80720 AT2G18720 AT2G39790 AT2G39795 AT2G41600 AT2G46190 AT3G46610 AT3G55605 AT3G63140 AT4G38090 AT5G02050 AT5G05990 AT5G08650 AT5G09920 AT5G39930 AT5G51220"
0.0632175878272009,9,11,2.34071520896165,"U4 snRNA 3 -end processing "," http://amigo.geneontology.org/amigo/term/GO:0034475","AT1G03360 AT1G60080 AT3G07750 AT3G12990 AT3G46210 AT3G60500 AT3G61620 AT4G27490 AT4G32175"
0.0632175878272009,9,11,2.34071520896165,"Membrane lipid catabolic process "," http://amigo.geneontology.org/amigo/term/GO:0046466","AT1G07380 AT1G18720 AT1G27980 AT1G33700 AT1G74440 AT2G38010 AT4G10060 AT5G49900 AT5G58980"
0.0653593040553979,46,92,1.43043707214323,"RNA localization "," http://amigo.geneontology.org/amigo/term/GO:0006403","AT1G02140 AT1G03140 AT1G03360 AT1G10390 AT1G15280 AT1G24310 AT1G33980 AT1G55540 AT1G63540 AT1G64750 AT1G66260 AT1G75340 AT1G79280 AT1G80670 AT1G80680 AT2G32415 AT2G41620 AT2G45000 AT2G45810 AT3G06290 AT3G14120 AT3G16310 AT3G19760 AT3G20430 AT3G27700 AT3G53110 AT3G56900 AT3G57350 AT3G61240 AT4G00660 AT4G14300 AT4G24880 AT4G28820 AT4G30840 AT4G32175 AT4G32910 AT5G02770 AT5G05680 AT5G09860 AT5G09920 AT5G11200 AT5G24650 AT5G37720 AT5G45010 AT5G51200 AT5G56130"
0.0664610488374285,21,35,1.71652448657188,"Maturation of 5.8S rRNA "," http://amigo.geneontology.org/amigo/term/GO:0000460","AT1G03360 AT1G23280 AT1G59760 AT1G60080 AT1G72320 AT2G06990 AT2G32415 AT2G37990 AT2G39820 AT3G07750 AT3G12990 AT3G56510 AT3G60500 AT4G01560 AT4G27010 AT4G32175 AT5G11010 AT5G12220 AT5G25080 AT5G48240 AT5G59460"
0.0686298360992424,60,126,1.36232102108879,"Translational initiation "," http://amigo.geneontology.org/amigo/term/GO:0006413","AT1G09150 AT1G10840 AT1G11480 AT1G16720 AT1G17220 AT1G17440 AT1G21160 AT1G26630 AT1G44780 AT1G48920 AT1G48970 AT1G52325 AT1G54290 AT1G54680 AT1G66520 AT1G71770 AT1G77840 AT2G04520 AT2G18720 AT2G24050 AT2G24060 AT2G27700 AT2G34750 AT2G34970 AT2G39820 AT2G40780 AT2G44070 AT2G45730 AT2G46280 AT2G46290 AT3G02200 AT3G07920 AT3G13640 AT3G13920 AT3G26400 AT3G46610 AT3G56160 AT3G57290 AT3G59410 AT4G11420 AT4G20330 AT4G21010 AT4G27130 AT4G30300 AT4G30680 AT4G30690 AT4G38090 AT4G39630 AT5G05470 AT5G06000 AT5G09920 AT5G11900 AT5G18110 AT5G19485 AT5G20920 AT5G27640 AT5G35680 AT5G44320 AT5G57650 AT5G65540"
0.0705684031891389,207,504,1.17500188068908,"Generation of precursor metabolites and energy "," http://amigo.geneontology.org/amigo/term/GO:0006091","AT1G02410 AT1G03310 AT1G03600 AT1G04410 AT1G04630 AT1G05385 AT1G05610 AT1G06680 AT1G07260 AT1G08380 AT1G08480 AT1G08500 AT1G09420 AT1G09780 AT1G12830 AT1G13700 AT1G14150 AT1G14450 AT1G15820 AT1G15980 AT1G16300 AT1G16720 AT1G18270 AT1G18730 AT1G20340 AT1G22170 AT1G22700 AT1G22840 AT1G24280 AT1G27695 AT1G29930 AT1G30120 AT1G32070 AT1G32440 AT1G32480 AT1G32550 AT1G34000 AT1G34430 AT1G45474 AT1G47420 AT1G48940 AT1G50250 AT1G50780 AT1G50940 AT1G53240 AT1G54220 AT1G54780 AT1G54870 AT1G55370 AT1G55480 AT1G55670 AT1G56190 AT1G59900 AT1G60660 AT1G64190 AT1G64640 AT1G64770 AT1G68750 AT1G70760 AT1G71500 AT1G74030 AT1G75690 AT1G78050 AT1G79040 AT1G79550 AT1G79800 AT2G01290 AT2G01590 AT2G01918 AT2G02510 AT2G17130 AT2G18450 AT2G20890 AT2G21590 AT2G21970 AT2G27150 AT2G29560 AT2G30950 AT2G31050 AT2G32720 AT2G33220 AT2G34420 AT2G34860 AT2G34910 AT2G36220 AT2G36390 AT2G36580 AT2G39930 AT2G43400 AT2G44350 AT2G45870 AT2G46390 AT2G47940 AT3G01070 AT3G01440 AT3G01850 AT3G03380 AT3G04790 AT3G06310 AT3G08010 AT3G08590 AT3G09490 AT3G09810 AT3G10370 AT3G10860 AT3G12780 AT3G13930 AT3G16250 AT3G18590 AT3G20440 AT3G20570 AT3G20790 AT3G21200 AT3G25860 AT3G27220 AT3G27240 AT3G27690 AT3G28958 AT3G43600 AT3G44190 AT3G45740 AT3G46610 AT3G47470 AT3G49160 AT3G53330 AT3G54050 AT3G55250 AT3G55810 AT3G60750 AT3G61320 AT4G00895 AT4G01100 AT4G01380 AT4G01390 AT4G03240 AT4G05450 AT4G09020 AT4G12880 AT4G14890 AT4G18370 AT4G19100 AT4G21280 AT4G22260 AT4G22890 AT4G23890 AT4G26390 AT4G26910 AT4G27520 AT4G27800 AT4G28005 AT4G28365 AT4G29130 AT4G31840 AT4G32590 AT4G32840 AT4G33930 AT4G34700 AT4G34890 AT4G34900 AT4G35650 AT4G35760 AT5G01920 AT5G02120 AT5G03880 AT5G05370 AT5G08570 AT5G08680 AT5G08740 AT5G10000 AT5G10040 AT5G11770 AT5G14590 AT5G18400 AT5G19220 AT5G20500 AT5G22140 AT5G25090 AT5G25450 AT5G28450 AT5G40650 AT5G40810 AT5G41670 AT5G42270 AT5G43330 AT5G43430 AT5G43940 AT5G45040 AT5G47810 AT5G48810 AT5G50850 AT5G52100 AT5G52840 AT5G52920 AT5G53560 AT5G54270 AT5G56720 AT5G57920 AT5G58330 AT5G59400 AT5G64210 AT5G65750 AT5G66190 AT5G67490 ATCG00480 ATCG00680 ATCG00720 ATCG01010"
0.0726721990657606,25,44,1.62549667289004,"MRNA modification "," http://amigo.geneontology.org/amigo/term/GO:0016556","AT1G01860 AT1G06140 AT1G11290 AT1G15480 AT1G59720 AT1G74230 AT1G74600 AT1G76120 AT2G20540 AT2G46050 AT3G02330 AT3G05240 AT3G06790 AT3G12770 AT3G18970 AT3G20930 AT4G09980 AT4G10760 AT4G11690 AT4G20020 AT5G08490 AT5G14460 AT5G44780 AT5G54580 AT5G61030"
0.0726721990657606,86,191,1.28814228486197,"Peptidyl-lysine modification "," http://amigo.geneontology.org/amigo/term/GO:0018205","AT1G01920 AT1G02740 AT1G04020 AT1G04640 AT1G04950 AT1G09060 AT1G09320 AT1G09730 AT1G10570 AT1G14030 AT1G14350 AT1G24610 AT1G26470 AT1G32470 AT1G49540 AT1G54140 AT1G54360 AT1G54840 AT1G60220 AT1G73100 AT1G73910 AT1G77300 AT1G77540 AT1G79280 AT2G16390 AT2G17900 AT2G19640 AT2G22740 AT2G23380 AT2G23740 AT2G31600 AT2G35160 AT2G35370 AT2G40020 AT2G42940 AT2G44150 AT2G47210 AT3G01460 AT3G02980 AT3G03750 AT3G07670 AT3G07740 AT3G09670 AT3G14980 AT3G15150 AT3G15605 AT3G20740 AT3G21820 AT3G22590 AT3G24870 AT3G24880 AT3G27460 AT3G49400 AT3G52030 AT3G52250 AT3G53860 AT3G55080 AT3G58180 AT3G58470 AT3G59960 AT4G00690 AT4G00830 AT4G14385 AT4G16420 AT4G18470 AT4G24940 AT4G26840 AT4G28190 AT4G29830 AT4G31050 AT4G33620 AT4G35987 AT5G04670 AT5G08415 AT5G09230 AT5G11340 AT5G13960 AT5G22010 AT5G22330 AT5G24330 AT5G27650 AT5G43990 AT5G50580 AT5G53430 AT5G57380 AT5G64610"
0.0726721990657606,25,44,1.62549667289004,"Cell cycle checkpoint signaling "," http://amigo.geneontology.org/amigo/term/GO:0000075","AT1G02970 AT1G52530 AT1G77320 AT1G77620 AT1G80710 AT2G19270 AT2G20635 AT2G29680 AT2G32900 AT2G33560 AT3G02680 AT3G19590 AT3G25980 AT3G54710 AT4G12620 AT4G14700 AT4G17760 AT4G29860 AT5G05510 AT5G39770 AT5G40820 AT5G49880 AT5G52910 AT5G52950 AT5G66130"
0.0726721990657606,52,107,1.39033135984015,"Mitotic nuclear division "," http://amigo.geneontology.org/amigo/term/GO:0140014","AT1G03780 AT1G04750 AT1G06590 AT1G07500 AT1G50490 AT1G61030 AT1G64960 AT1G73790 AT1G78770 AT2G20635 AT2G32590 AT2G32900 AT2G33560 AT2G39090 AT3G01015 AT3G05870 AT3G07160 AT3G10525 AT3G16320 AT3G16730 AT3G19590 AT3G20898 AT3G25980 AT3G27630 AT3G48150 AT3G55340 AT3G57060 AT3G60460 AT3G61650 AT4G05360 AT4G15890 AT4G21530 AT4G34660 AT4G38560 AT5G03830 AT5G04470 AT5G05490 AT5G05510 AT5G05560 AT5G05620 AT5G07170 AT5G07590 AT5G11340 AT5G12150 AT5G15510 AT5G19390 AT5G37630 AT5G44270 AT5G47690 AT5G49880 AT5G52220 AT5G62240"
0.0726721990657606,39,76,1.46808015298911,"Protein targeting to membrane "," http://amigo.geneontology.org/amigo/term/GO:0006612","AT1G01910 AT1G33040 AT1G48160 AT1G48635 AT1G67680 AT2G20890 AT2G20990 AT2G31530 AT2G33640 AT2G43640 AT3G03490 AT3G04970 AT3G09740 AT3G10350 AT3G11820 AT3G12390 AT3G18620 AT3G20920 AT3G22180 AT3G49100 AT3G49470 AT3G51390 AT3G53120 AT3G56920 AT3G60800 AT4G00840 AT4G08320 AT4G10480 AT4G21180 AT5G03940 AT5G05070 AT5G13850 AT5G17550 AT5G41060 AT5G49500 AT5G52440 AT5G55500 AT5G60730 AT5G66970"
0.0770407366991428,32,60,1.52579954361945,"Regulation of RNA stability "," http://amigo.geneontology.org/amigo/term/GO:0043487","AT1G03360 AT1G06450 AT1G19120 AT1G27890 AT1G27960 AT1G31500 AT1G55500 AT1G60080 AT1G61470 AT1G71720 AT1G71770 AT1G79090 AT1G79270 AT2G17975 AT2G22090 AT2G24350 AT3G07750 AT3G12640 AT3G12990 AT3G13460 AT3G14080 AT3G20250 AT3G22270 AT3G56860 AT3G58580 AT3G60500 AT4G31850 AT4G32175 AT4G34830 AT5G09920 AT5G13570 AT5G61020"
0.0786232615608163,17,27,1.80129112788407,"DNA integrity checkpoint signaling "," http://amigo.geneontology.org/amigo/term/GO:0031570","AT1G02970 AT1G52530 AT1G77320 AT1G77620 AT1G80710 AT2G29680 AT3G02680 AT3G54710 AT4G12620 AT4G14700 AT4G17760 AT4G29860 AT5G39770 AT5G40820 AT5G52910 AT5G52950 AT5G66130"
0.0786232615608163,17,27,1.80129112788407,"Group II intron splicing "," http://amigo.geneontology.org/amigo/term/GO:0000373","AT1G23400 AT1G30010 AT1G71310 AT2G39120 AT3G01370 AT3G16010 AT3G22330 AT3G23070 AT3G23990 AT3G27750 AT4G01037 AT4G01400 AT4G14510 AT4G31010 AT5G04050 AT5G26742 AT5G46920"
