"Enrichment FDR","nGenes","Pathway Genes","Fold Enrichment","Pathway","URL","Genes"
0.000871958438742223,59,106,1.59237334446134,"Ribosomal large subunit biogenesis "," http://amigo.geneontology.org/amigo/term/GO:0042273","AT1G02870 AT1G07070 AT1G08360 AT1G13160 AT1G14320 AT1G16740 AT1G18540 AT1G23280 AT1G26910 AT1G29320 AT1G32990 AT1G52930 AT1G61580 AT1G74050 AT1G74060 AT1G74270 AT1G80750 AT2G07725 AT2G18220 AT2G20450 AT2G27750 AT2G36620 AT2G37190 AT2G37990 AT2G39390 AT2G39460 AT2G39820 AT2G40010 AT2G40430 AT2G42650 AT2G42740 AT2G44860 AT3G06320 AT3G11250 AT3G13580 AT3G15460 AT3G22660 AT3G53020 AT3G55170 AT3G63490 AT4G01310 AT4G01560 AT4G12600 AT4G15770 AT4G27010 AT4G27090 AT4G28820 AT4G31420 AT4G31520 AT5G02610 AT5G04600 AT5G05210 AT5G11010 AT5G12220 AT5G48240 AT5G61770 AT5G65900 AT5G67510 ATCG00840"
0.000912692530672881,24,33,2.08063574129925,"TRNA methylation "," http://amigo.geneontology.org/amigo/term/GO:0030488","AT1G03110 AT1G13870 AT1G22270 AT1G60230 AT1G78190 AT2G22400 AT2G45730 AT3G19630 AT3G21300 AT3G26410 AT3G56120 AT3G56330 AT4G01880 AT4G17610 AT4G28020 AT4G40000 AT5G01230 AT5G13680 AT5G14600 AT5G15390 AT5G15810 AT5G17660 AT5G24840 AT5G47680"
0.00101539598437735,109,223,1.39836449205034,"TRNA metabolic process "," http://amigo.geneontology.org/amigo/term/GO:0006399","AT1G01210 AT1G01760 AT1G03110 AT1G03360 AT1G03687 AT1G04635 AT1G04640 AT1G09290 AT1G09620 AT1G09800 AT1G10490 AT1G13870 AT1G17960 AT1G22270 AT1G22660 AT1G25350 AT1G25410 AT1G29880 AT1G31600 AT1G49540 AT1G60080 AT1G60230 AT1G66520 AT1G68420 AT1G72090 AT1G74700 AT1G75200 AT1G76120 AT1G78190 AT2G04530 AT2G04842 AT2G15910 AT2G18410 AT2G22400 AT2G25840 AT2G27760 AT2G32415 AT2G33840 AT2G41750 AT2G43190 AT2G45270 AT2G45330 AT2G45695 AT2G45730 AT3G02370 AT3G06950 AT3G07750 AT3G11220 AT3G11800 AT3G12990 AT3G13490 AT3G16260 AT3G19630 AT3G21300 AT3G24560 AT3G26410 AT3G44150 AT3G44740 AT3G45590 AT3G46100 AT3G49640 AT3G55400 AT3G56120 AT3G56300 AT3G56310 AT3G56330 AT3G57360 AT3G57940 AT3G58140 AT3G60500 AT3G62120 AT3G63510 AT4G01880 AT4G04350 AT4G10130 AT4G16510 AT4G17300 AT4G17610 AT4G18460 AT4G21900 AT4G26300 AT4G26870 AT4G28020 AT4G32175 AT4G34412 AT4G36390 AT4G38160 AT4G40000 AT5G01230 AT5G03406 AT5G10880 AT5G13680 AT5G14460 AT5G14600 AT5G15390 AT5G15810 AT5G17660 AT5G23600 AT5G24840 AT5G26710 AT5G27470 AT5G35400 AT5G39930 AT5G47680 AT5G47970 AT5G49030 AT5G55130 AT5G60230 AT5G67220"
0.00151119506043902,241,555,1.24228949328475,"Chromosome organization "," http://amigo.geneontology.org/amigo/term/GO:0051276","AT1G01690 AT1G02740 AT1G03770 AT1G06590 AT1G06670 AT1G06760 AT1G07745 AT1G07790 AT1G08390 AT1G08460 AT1G08600 AT1G08620 AT1G08840 AT1G08880 AT1G09320 AT1G10390 AT1G10940 AT1G13330 AT1G13790 AT1G14510 AT1G14790 AT1G15215 AT1G16970 AT1G17520 AT1G20750 AT1G21610 AT1G21700 AT1G22260 AT1G24290 AT1G27880 AT1G30810 AT1G32750 AT1G48360 AT1G50490 AT1G51060 AT1G52530 AT1G52740 AT1G53490 AT1G54230 AT1G54390 AT1G54690 AT1G61030 AT1G63540 AT1G63990 AT1G64960 AT1G67370 AT1G72740 AT1G73100 AT1G73150 AT1G73790 AT1G74560 AT1G77300 AT1G78770 AT1G79350 AT1G79890 AT1G79950 AT1G80670 AT2G01280 AT2G03270 AT2G05210 AT2G16390 AT2G16780 AT2G17560 AT2G17900 AT2G19640 AT2G19670 AT2G19930 AT2G20635 AT2G22740 AT2G23080 AT2G23380 AT2G23740 AT2G25170 AT2G27470 AT2G28380 AT2G30620 AT2G31970 AT2G32590 AT2G32900 AT2G33560 AT2G35160 AT2G38810 AT2G39090 AT2G43410 AT2G44150 AT2G45700 AT2G46020 AT2G47210 AT2G47980 AT3G02680 AT3G02980 AT3G03750 AT3G05740 AT3G05870 AT3G07610 AT3G07740 AT3G09480 AT3G09660 AT3G10270 AT3G10390 AT3G10400 AT3G10440 AT3G12280 AT3G12380 AT3G12530 AT3G12550 AT3G12810 AT3G13782 AT3G14120 AT3G14980 AT3G16320 AT3G16730 AT3G18730 AT3G19590 AT3G20670 AT3G20740 AT3G20780 AT3G21820 AT3G22990 AT3G24010 AT3G24495 AT3G24870 AT3G24880 AT3G25980 AT3G26680 AT3G27460 AT3G27730 AT3G33520 AT3G36659 AT3G44490 AT3G44660 AT3G44750 AT3G45980 AT3G46030 AT3G47460 AT3G48150 AT3G48470 AT3G48710 AT3G49250 AT3G49500 AT3G51880 AT3G53650 AT3G54710 AT3G57060 AT3G57300 AT3G59960 AT3G61650 AT3G62800 AT3G63480 AT4G02060 AT4G05360 AT4G08590 AT4G11560 AT4G12620 AT4G13570 AT4G14385 AT4G14790 AT4G15890 AT4G16265 AT4G16310 AT4G16420 AT4G17380 AT4G19020 AT4G19130 AT4G20400 AT4G21530 AT4G25120 AT4G25540 AT4G29510 AT4G31120 AT4G31210 AT4G32820 AT4G34412 AT4G35050 AT4G37210 AT4G38495 AT4G38560 AT5G02560 AT5G02570 AT5G02820 AT5G03470 AT5G04130 AT5G04240 AT5G04320 AT5G05490 AT5G05510 AT5G05560 AT5G05610 AT5G05620 AT5G06310 AT5G07590 AT5G07660 AT5G08020 AT5G08780 AT5G10710 AT5G11340 AT5G12360 AT5G13130 AT5G13960 AT5G16850 AT5G17690 AT5G18620 AT5G20510 AT5G20930 AT5G22330 AT5G22650 AT5G22750 AT5G24330 AT5G24630 AT5G26040 AT5G26210 AT5G28690 AT5G37630 AT5G40530 AT5G40820 AT5G41360 AT5G43500 AT5G43990 AT5G44280 AT5G44635 AT5G45400 AT5G47690 AT5G49020 AT5G49880 AT5G51230 AT5G52220 AT5G53430 AT5G55600 AT5G57450 AT5G58230 AT5G58270 AT5G58575 AT5G59910 AT5G61000 AT5G61140 AT5G61460 AT5G62410 AT5G62760 AT5G63550 AT5G63920 AT5G64610"
0.00186338776345738,54,97,1.59265158547906,"Protein maturation "," http://amigo.geneontology.org/amigo/term/GO:0051604","AT1G03150 AT1G04640 AT1G07510 AT1G08700 AT1G10500 AT1G14270 AT1G32470 AT1G34640 AT1G51390 AT1G52600 AT1G53530 AT1G62710 AT1G68310 AT1G73990 AT1G79340 AT1G79560 AT1G80410 AT2G11000 AT2G20725 AT2G23940 AT2G25940 AT2G35260 AT2G35370 AT2G36260 AT2G36305 AT2G38130 AT2G42700 AT3G02980 AT3G03420 AT3G05230 AT3G19170 AT3G24590 AT3G50845 AT3G52640 AT3G58180 AT4G00590 AT4G01320 AT4G01940 AT4G16700 AT4G17840 AT4G31050 AT4G32940 AT4G33410 AT4G40042 AT5G03905 AT5G06410 AT5G07120 AT5G08415 AT5G13780 AT5G20650 AT5G27430 AT5G58440 AT5G58450 AT5G60750"
0.00221532910196392,312,742,1.20295516579161,"Protein-containing complex subunit organization "," http://amigo.geneontology.org/amigo/term/GO:0043933","AT1G01750 AT1G03050 AT1G03140 AT1G03530 AT1G03600 AT1G04020 AT1G04080 AT1G05385 AT1G05780 AT1G06760 AT1G07510 AT1G07790 AT1G08600 AT1G09100 AT1G09150 AT1G10840 AT1G10865 AT1G12470 AT1G13030 AT1G14320 AT1G14450 AT1G14686 AT1G15220 AT1G15440 AT1G16720 AT1G16740 AT1G17070 AT1G17130 AT1G17440 AT1G17520 AT1G18540 AT1G19580 AT1G20000 AT1G20260 AT1G20580 AT1G20770 AT1G21460 AT1G21610 AT1G22700 AT1G22800 AT1G24310 AT1G26630 AT1G26910 AT1G32640 AT1G32750 AT1G32990 AT1G34000 AT1G47260 AT1G48160 AT1G48170 AT1G48920 AT1G52825 AT1G52930 AT1G53750 AT1G54050 AT1G54230 AT1G55480 AT1G56350 AT1G59840 AT1G60430 AT1G60460 AT1G61210 AT1G61580 AT1G62730 AT1G62850 AT1G63270 AT1G64520 AT1G64660 AT1G64750 AT1G65080 AT1G66510 AT1G67440 AT1G70760 AT1G71440 AT1G71500 AT1G71790 AT1G72080 AT1G72370 AT1G72740 AT1G73790 AT1G74050 AT1G74060 AT1G74560 AT1G75310 AT1G76300 AT1G77840 AT1G79040 AT1G79350 AT1G79560 AT1G80070 AT1G80245 AT1G80270 AT2G01280 AT2G01470 AT2G01920 AT2G02510 AT2G02955 AT2G07725 AT2G18390 AT2G18720 AT2G20760 AT2G20890 AT2G27470 AT2G29500 AT2G30620 AT2G30910 AT2G30950 AT2G31040 AT2G31200 AT2G31300 AT2G32050 AT2G32600 AT2G34050 AT2G34860 AT2G34910 AT2G35790 AT2G36620 AT2G37190 AT2G37270 AT2G37340 AT2G38020 AT2G38440 AT2G39120 AT2G39460 AT2G39725 AT2G39820 AT2G40010 AT2G40060 AT2G40430 AT2G42270 AT2G42330 AT2G42510 AT2G42540 AT2G42740 AT2G44860 AT2G45710 AT2G45990 AT2G46225 AT2G46280 AT2G46290 AT2G46455 AT2G47210 AT2G47640 AT2G47690 AT3G01015 AT3G02080 AT3G02200 AT3G03340 AT3G03420 AT3G03773 AT3G03970 AT3G04550 AT3G06320 AT3G07590 AT3G07920 AT3G08010 AT3G09480 AT3G10070 AT3G11070 AT3G11250 AT3G12810 AT3G13210 AT3G13640 AT3G13782 AT3G13940 AT3G15460 AT3G16010 AT3G16310 AT3G16640 AT3G17930 AT3G18310 AT3G22590 AT3G26618 AT3G27310 AT3G33520 AT3G44160 AT3G45980 AT3G46030 AT3G46110 AT3G46230 AT3G46610 AT3G46740 AT3G53020 AT3G53030 AT3G53650 AT3G53760 AT3G54710 AT3G55250 AT3G56160 AT3G56190 AT3G56450 AT3G56510 AT3G56910 AT3G57290 AT3G57300 AT3G57370 AT3G60150 AT3G60740 AT3G61110 AT3G61650 AT3G62910 AT4G00680 AT4G01310 AT4G01400 AT4G02060 AT4G02450 AT4G02840 AT4G03120 AT4G04330 AT4G10250 AT4G11420 AT4G12770 AT4G12780 AT4G13510 AT4G14110 AT4G14680 AT4G18600 AT4G19100 AT4G19540 AT4G20260 AT4G20340 AT4G21870 AT4G22350 AT4G24690 AT4G25590 AT4G26430 AT4G26965 AT4G28820 AT4G29350 AT4G29530 AT4G30300 AT4G30940 AT4G31010 AT4G32820 AT4G34090 AT4G35540 AT4G35760 AT4G37200 AT4G37210 AT4G38510 AT4G38780 AT4G39160 AT4G39740 AT5G02120 AT5G02570 AT5G03340 AT5G03940 AT5G05520 AT5G05620 AT5G06000 AT5G06410 AT5G06680 AT5G08390 AT5G08780 AT5G09920 AT5G10710 AT5G11770 AT5G11900 AT5G13010 AT5G15520 AT5G16690 AT5G17410 AT5G18410 AT5G18440 AT5G18620 AT5G20720 AT5G20920 AT5G20935 AT5G22330 AT5G22840 AT5G23120 AT5G25450 AT5G27640 AT5G28740 AT5G28750 AT5G36170 AT5G38660 AT5G38720 AT5G40660 AT5G41330 AT5G41520 AT5G41770 AT5G42270 AT5G42980 AT5G44320 AT5G44635 AT5G45010 AT5G46400 AT5G47880 AT5G49510 AT5G51110 AT5G51220 AT5G52110 AT5G52650 AT5G52980 AT5G54290 AT5G56280 AT5G57200 AT5G57320 AT5G58260 AT5G59890 AT5G59910 AT5G60870 AT5G61770 AT5G62050 AT5G62850 AT5G64270 AT5G65274 AT5G66510 AT5G67490 ATCG00680 ATCG00840"
0.00221532910196392,103,212,1.38995300406371,"Nuclear division "," http://amigo.geneontology.org/amigo/term/GO:0000280","AT1G01690 AT1G03780 AT1G04030 AT1G04750 AT1G06590 AT1G06660 AT1G07500 AT1G07745 AT1G13330 AT1G20750 AT1G22260 AT1G48360 AT1G50240 AT1G50490 AT1G53490 AT1G60460 AT1G61030 AT1G63990 AT1G64960 AT1G65010 AT1G67370 AT1G73790 AT1G77320 AT1G78770 AT2G20635 AT2G30820 AT2G32590 AT2G32900 AT2G33400 AT2G33560 AT2G33640 AT2G33793 AT2G39090 AT2G47980 AT3G01015 AT3G02680 AT3G02930 AT3G05870 AT3G07160 AT3G09660 AT3G10440 AT3G10525 AT3G12280 AT3G16320 AT3G16730 AT3G19210 AT3G19590 AT3G20898 AT3G25980 AT3G27630 AT3G27730 AT3G48150 AT3G50960 AT3G55340 AT3G57060 AT3G60460 AT3G61650 AT3G63480 AT4G01370 AT4G05360 AT4G15890 AT4G17380 AT4G20900 AT4G21270 AT4G21530 AT4G25540 AT4G27595 AT4G32190 AT4G34660 AT4G35520 AT4G38560 AT5G02820 AT5G03470 AT5G03830 AT5G04320 AT5G04470 AT5G05490 AT5G05510 AT5G05560 AT5G05620 AT5G07170 AT5G07590 AT5G11340 AT5G12150 AT5G12360 AT5G15510 AT5G19390 AT5G22010 AT5G37630 AT5G39770 AT5G41150 AT5G44040 AT5G44270 AT5G47690 AT5G49880 AT5G52220 AT5G52290 AT5G56580 AT5G62240 AT5G63540 AT5G63920 AT5G66030 AT5G66410"
0.00254581081071268,54,98,1.57640003868846,"TRNA modification "," http://amigo.geneontology.org/amigo/term/GO:0006400","AT1G01760 AT1G03110 AT1G09290 AT1G10490 AT1G13870 AT1G22270 AT1G25410 AT1G31600 AT1G60230 AT1G66520 AT1G72090 AT1G75200 AT1G76120 AT1G78190 AT2G15910 AT2G18410 AT2G22400 AT2G27760 AT2G41750 AT2G45270 AT2G45695 AT2G45730 AT3G06950 AT3G11220 AT3G11800 AT3G19630 AT3G21300 AT3G26410 AT3G44150 AT3G49640 AT3G56120 AT3G56330 AT3G57940 AT3G63510 AT4G01880 AT4G10130 AT4G17610 AT4G28020 AT4G34412 AT4G36390 AT4G40000 AT5G01230 AT5G13680 AT5G14460 AT5G14600 AT5G15390 AT5G15810 AT5G17660 AT5G24840 AT5G35400 AT5G47680 AT5G47970 AT5G55130 AT5G67220"
0.00254581081071268,113,237,1.36404547807751,"Protein targeting "," http://amigo.geneontology.org/amigo/term/GO:0006605","AT1G01910 AT1G03000 AT1G04070 AT1G06950 AT1G13900 AT1G17530 AT1G20350 AT1G21650 AT1G27390 AT1G33040 AT1G36390 AT1G48160 AT1G48635 AT1G48760 AT1G50400 AT1G53530 AT1G61570 AT1G63900 AT1G64220 AT1G67680 AT1G72750 AT1G79560 AT1G79810 AT2G15290 AT2G16640 AT2G19080 AT2G20890 AT2G20990 AT2G24020 AT2G24820 AT2G29530 AT2G31530 AT2G33640 AT2G34940 AT2G37410 AT2G37680 AT2G43640 AT2G45790 AT2G45980 AT3G03490 AT3G04970 AT3G05230 AT3G07560 AT3G07910 AT3G09700 AT3G09740 AT3G10350 AT3G11070 AT3G11820 AT3G12390 AT3G18620 AT3G20920 AT3G22180 AT3G25120 AT3G44160 AT3G46740 AT3G47810 AT3G48870 AT3G49100 AT3G49470 AT3G51390 AT3G52850 AT3G53120 AT3G56920 AT3G59280 AT3G60800 AT3G62880 AT4G00840 AT4G01800 AT4G02510 AT4G08320 AT4G10480 AT4G15810 AT4G20110 AT4G21180 AT4G23940 AT4G24550 AT4G24690 AT4G26780 AT4G35450 AT4G38490 AT4G40042 AT5G01590 AT5G03030 AT5G03940 AT5G05000 AT5G05070 AT5G05520 AT5G05670 AT5G11710 AT5G13850 AT5G16830 AT5G17550 AT5G18525 AT5G20300 AT5G24650 AT5G27280 AT5G27430 AT5G39510 AT5G41060 AT5G41685 AT5G43970 AT5G49500 AT5G49910 AT5G52440 AT5G55200 AT5G55500 AT5G56290 AT5G60730 AT5G61010 AT5G62810 AT5G66970 ATCG00860"
0.00281543954997187,100,206,1.38877385644974,"DNA recombination "," http://amigo.geneontology.org/amigo/term/GO:0006310","AT1G01690 AT1G04020 AT1G06760 AT1G07745 AT1G08125 AT1G08390 AT1G10940 AT1G13330 AT1G16970 AT1G20750 AT1G22260 AT1G27880 AT1G30010 AT1G52530 AT1G53490 AT1G54230 AT1G60460 AT1G61410 AT1G63990 AT1G64750 AT1G65010 AT1G65070 AT1G67370 AT1G68310 AT1G71310 AT1G74560 AT1G75950 AT1G79050 AT1G79950 AT2G01280 AT2G19490 AT2G22140 AT2G24490 AT2G26840 AT2G30620 AT2G31970 AT2G33640 AT2G33793 AT3G02680 AT3G02920 AT3G02930 AT3G05740 AT3G09660 AT3G10140 AT3G10605 AT3G12530 AT3G13782 AT3G15150 AT3G19210 AT3G23100 AT3G24495 AT3G27730 AT3G52115 AT3G52630 AT3G57300 AT4G02060 AT4G02460 AT4G05360 AT4G16970 AT4G17380 AT4G18470 AT4G18590 AT4G19130 AT4G23440 AT4G25120 AT4G25540 AT4G27595 AT4G32190 AT4G34412 AT4G35520 AT4G38560 AT5G01630 AT5G02820 AT5G04050 AT5G05490 AT5G07660 AT5G08020 AT5G08780 AT5G15685 AT5G22010 AT5G22750 AT5G39770 AT5G41150 AT5G43210 AT5G44635 AT5G45010 AT5G45400 AT5G46920 AT5G47870 AT5G50340 AT5G52290 AT5G54090 AT5G57160 AT5G57450 AT5G61000 AT5G61460 AT5G63540 AT5G63920 AT5G63950 AT5G66030"
0.00289886655735598,221,509,1.24214771294167,"Peptidyl-amino acid modification "," http://amigo.geneontology.org/amigo/term/GO:0018193","AT1G01920 AT1G01940 AT1G02740 AT1G02970 AT1G03150 AT1G04020 AT1G04210 AT1G04640 AT1G04900 AT1G04950 AT1G07570 AT1G08650 AT1G09060 AT1G09320 AT1G09450 AT1G09730 AT1G10570 AT1G14030 AT1G14350 AT1G15390 AT1G18350 AT1G18890 AT1G20270 AT1G20810 AT1G24610 AT1G26470 AT1G26550 AT1G27320 AT1G30640 AT1G32470 AT1G45160 AT1G49540 AT1G50700 AT1G53720 AT1G54140 AT1G54360 AT1G54840 AT1G56085 AT1G60220 AT1G61790 AT1G61950 AT1G67840 AT1G68080 AT1G71220 AT1G72180 AT1G72710 AT1G72990 AT1G73100 AT1G73910 AT1G74740 AT1G74800 AT1G76400 AT1G77300 AT1G77350 AT1G77540 AT1G79280 AT1G80410 AT2G01720 AT2G11000 AT2G15910 AT2G16390 AT2G17900 AT2G19640 AT2G19670 AT2G22740 AT2G23070 AT2G23080 AT2G23380 AT2G23740 AT2G24360 AT2G25880 AT2G29960 AT2G30695 AT2G30730 AT2G30880 AT2G31500 AT2G31600 AT2G31880 AT2G33640 AT2G35160 AT2G35370 AT2G38130 AT2G40020 AT2G40940 AT2G42940 AT2G43080 AT2G43230 AT2G44150 AT2G47210 AT2G47320 AT3G01460 AT3G01480 AT3G02980 AT3G03750 AT3G04970 AT3G06230 AT3G06300 AT3G07670 AT3G07740 AT3G09670 AT3G10060 AT3G10540 AT3G11800 AT3G12270 AT3G12340 AT3G13380 AT3G13670 AT3G14980 AT3G15150 AT3G15520 AT3G15605 AT3G15890 AT3G17750 AT3G18620 AT3G20740 AT3G21220 AT3G21340 AT3G21820 AT3G22180 AT3G22590 AT3G22942 AT3G24870 AT3G24880 AT3G27460 AT3G44150 AT3G44600 AT3G49400 AT3G50000 AT3G51390 AT3G52030 AT3G52250 AT3G53570 AT3G53860 AT3G55080 AT3G55520 AT3G55920 AT3G56920 AT3G58180 AT3G58470 AT3G59350 AT3G59410 AT3G59630 AT3G59960 AT3G60800 AT3G62030 AT3G63400 AT4G00234 AT4G00690 AT4G00830 AT4G00840 AT4G03175 AT4G09570 AT4G10130 AT4G14385 AT4G16420 AT4G16570 AT4G16970 AT4G17410 AT4G18470 AT4G21940 AT4G24940 AT4G25600 AT4G26070 AT4G26840 AT4G28190 AT4G29510 AT4G29830 AT4G31050 AT4G31120 AT4G32660 AT4G32830 AT4G33430 AT4G33620 AT4G35810 AT4G35987 AT4G36070 AT4G38230 AT5G04510 AT5G04670 AT5G05070 AT5G05420 AT5G08280 AT5G08415 AT5G09230 AT5G10720 AT5G11340 AT5G11400 AT5G13780 AT5G13960 AT5G14660 AT5G18190 AT5G19360 AT5G19450 AT5G20930 AT5G22010 AT5G22050 AT5G22330 AT5G23580 AT5G24330 AT5G27650 AT5G40440 AT5G41060 AT5G43320 AT5G43990 AT5G48580 AT5G49020 AT5G50580 AT5G51880 AT5G53340 AT5G53430 AT5G56580 AT5G57380 AT5G58450 AT5G58710 AT5G58950 AT5G62620 AT5G63080 AT5G64610 AT5G65860 AT5G67380 AT5G67530"
0.00339486053017306,175,393,1.27392614567464,"DNA repair "," http://amigo.geneontology.org/amigo/term/GO:0006281","AT1G01880 AT1G03750 AT1G04020 AT1G07370 AT1G07745 AT1G08125 AT1G08260 AT1G08390 AT1G08600 AT1G08840 AT1G09770 AT1G10940 AT1G11780 AT1G11800 AT1G12370 AT1G14400 AT1G14460 AT1G14800 AT1G16190 AT1G16590 AT1G16890 AT1G16970 AT1G18090 AT1G19485 AT1G20750 AT1G21710 AT1G24290 AT1G27880 AT1G29850 AT1G30480 AT1G34770 AT1G48360 AT1G52500 AT1G52530 AT1G55750 AT1G61410 AT1G63990 AT1G64750 AT1G65070 AT1G71260 AT1G71310 AT1G74560 AT1G75090 AT1G75230 AT1G77470 AT1G77620 AT1G78650 AT1G79050 AT1G79650 AT1G79950 AT1G80850 AT2G01280 AT2G02740 AT2G02760 AT2G06040 AT2G17930 AT2G19490 AT2G20330 AT2G22140 AT2G22260 AT2G23080 AT2G24490 AT2G27120 AT2G28105 AT2G29570 AT2G31450 AT2G31970 AT2G32950 AT2G33640 AT2G35320 AT2G45700 AT2G47210 AT3G02680 AT3G02920 AT3G04880 AT3G05740 AT3G06820 AT3G07930 AT3G09660 AT3G10140 AT3G10605 AT3G12040 AT3G12380 AT3G12530 AT3G13226 AT3G13782 AT3G14140 AT3G14160 AT3G15150 AT3G15620 AT3G16730 AT3G16980 AT3G18630 AT3G19210 AT3G23100 AT3G23580 AT3G24320 AT3G24495 AT3G26680 AT3G28730 AT3G46940 AT3G48710 AT3G52115 AT3G52630 AT3G57110 AT3G57300 AT3G60950 AT3G61800 AT4G02060 AT4G02460 AT4G05360 AT4G05420 AT4G15475 AT4G16265 AT4G16970 AT4G17020 AT4G17380 AT4G17760 AT4G18470 AT4G18590 AT4G19130 AT4G21100 AT4G23440 AT4G25120 AT4G25540 AT4G29860 AT4G31150 AT4G35520 AT4G36050 AT4G38560 AT5G01630 AT5G02820 AT5G03450 AT5G05490 AT5G07400 AT5G07660 AT5G08020 AT5G13130 AT5G15170 AT5G22010 AT5G22110 AT5G22750 AT5G26680 AT5G39770 AT5G40820 AT5G41150 AT5G41360 AT5G43210 AT5G43500 AT5G44635 AT5G44740 AT5G44750 AT5G45010 AT5G45400 AT5G47690 AT5G47870 AT5G49110 AT5G50340 AT5G52800 AT5G52910 AT5G54090 AT5G57160 AT5G57450 AT5G57970 AT5G58760 AT5G61000 AT5G61460 AT5G62540 AT5G63540 AT5G63550 AT5G63920 AT5G63960 AT5G64610 AT5G65740 AT5G66130"
0.00339486053017306,188,426,1.26254539700905,"Cellular response to DNA damage stimulus "," http://amigo.geneontology.org/amigo/term/GO:0006974","AT1G01880 AT1G03750 AT1G04020 AT1G07370 AT1G07500 AT1G07745 AT1G08125 AT1G08260 AT1G08390 AT1G08600 AT1G08840 AT1G09770 AT1G10940 AT1G11780 AT1G11800 AT1G12370 AT1G14400 AT1G14460 AT1G14800 AT1G16190 AT1G16590 AT1G16890 AT1G16970 AT1G18090 AT1G19485 AT1G20750 AT1G21710 AT1G24290 AT1G27880 AT1G29850 AT1G30480 AT1G34770 AT1G43850 AT1G48360 AT1G52500 AT1G52530 AT1G55460 AT1G55750 AT1G61410 AT1G63990 AT1G64750 AT1G65070 AT1G68310 AT1G68760 AT1G71260 AT1G71310 AT1G74560 AT1G75090 AT1G75230 AT1G77320 AT1G77470 AT1G77620 AT1G78650 AT1G79050 AT1G79650 AT1G79950 AT1G80710 AT1G80850 AT2G01280 AT2G02740 AT2G02760 AT2G06040 AT2G17930 AT2G19490 AT2G20330 AT2G22140 AT2G22260 AT2G23080 AT2G24490 AT2G27120 AT2G27470 AT2G28105 AT2G29570 AT2G31450 AT2G31970 AT2G32950 AT2G33640 AT2G35320 AT2G45700 AT2G47210 AT3G02680 AT3G02920 AT3G04880 AT3G05740 AT3G06820 AT3G07930 AT3G09660 AT3G10140 AT3G10605 AT3G12040 AT3G12380 AT3G12530 AT3G13226 AT3G13782 AT3G14140 AT3G14160 AT3G15150 AT3G15620 AT3G16730 AT3G16980 AT3G18630 AT3G19210 AT3G23100 AT3G23580 AT3G24320 AT3G24495 AT3G26680 AT3G27630 AT3G28730 AT3G46940 AT3G48710 AT3G52115 AT3G52630 AT3G57110 AT3G57300 AT3G60950 AT3G61800 AT4G02060 AT4G02460 AT4G05360 AT4G05420 AT4G15475 AT4G16265 AT4G16970 AT4G17020 AT4G17380 AT4G17760 AT4G18470 AT4G18590 AT4G19130 AT4G21100 AT4G23440 AT4G25120 AT4G25540 AT4G29860 AT4G31150 AT4G35520 AT4G36050 AT4G38560 AT5G01630 AT5G02820 AT5G03450 AT5G03830 AT5G05490 AT5G06460 AT5G07400 AT5G07660 AT5G08020 AT5G13130 AT5G15170 AT5G22010 AT5G22110 AT5G22750 AT5G26680 AT5G39770 AT5G40820 AT5G41150 AT5G41360 AT5G43210 AT5G43500 AT5G44635 AT5G44740 AT5G44750 AT5G45010 AT5G45400 AT5G47690 AT5G47870 AT5G49110 AT5G50340 AT5G52800 AT5G52910 AT5G52950 AT5G54090 AT5G57160 AT5G57450 AT5G57970 AT5G58760 AT5G60870 AT5G61000 AT5G61460 AT5G62540 AT5G63540 AT5G63550 AT5G63920 AT5G63960 AT5G64610 AT5G65740 AT5G66130"
0.00363939749063973,27,41,1.88399029013987,"Chromosome separation "," http://amigo.geneontology.org/amigo/term/GO:0051304","AT1G06590 AT1G50490 AT1G78770 AT2G20635 AT2G32900 AT2G33560 AT2G39090 AT3G05870 AT3G16320 AT3G16730 AT3G19590 AT3G25980 AT3G27730 AT3G48150 AT3G57060 AT4G15890 AT4G17380 AT4G21530 AT5G05510 AT5G05560 AT5G22010 AT5G39770 AT5G41150 AT5G49880 AT5G52290 AT5G63540 AT5G63920"
0.00386043917758329,246,576,1.22183166578901,"Cellular protein-containing complex assembly "," http://amigo.geneontology.org/amigo/term/GO:0034622","AT1G03050 AT1G03140 AT1G03530 AT1G03600 AT1G04020 AT1G04080 AT1G05385 AT1G05780 AT1G06760 AT1G07790 AT1G09100 AT1G09150 AT1G10840 AT1G10865 AT1G12470 AT1G13030 AT1G14320 AT1G14450 AT1G14686 AT1G15220 AT1G15440 AT1G16720 AT1G16740 AT1G17130 AT1G17440 AT1G17520 AT1G18540 AT1G20000 AT1G20260 AT1G20580 AT1G20770 AT1G22700 AT1G22800 AT1G26910 AT1G32750 AT1G32990 AT1G34000 AT1G48160 AT1G48170 AT1G48920 AT1G52825 AT1G52930 AT1G53750 AT1G54230 AT1G55480 AT1G59840 AT1G60430 AT1G61580 AT1G62730 AT1G63270 AT1G64520 AT1G64750 AT1G65080 AT1G66510 AT1G67440 AT1G70760 AT1G71440 AT1G71500 AT1G71790 AT1G72080 AT1G72370 AT1G72740 AT1G73790 AT1G74050 AT1G74060 AT1G74560 AT1G76300 AT1G77840 AT1G79040 AT1G79350 AT1G80070 AT1G80245 AT1G80270 AT2G01280 AT2G01920 AT2G02510 AT2G02955 AT2G07725 AT2G18390 AT2G18720 AT2G20760 AT2G20890 AT2G30620 AT2G30910 AT2G30950 AT2G31040 AT2G31300 AT2G32050 AT2G32600 AT2G34050 AT2G34860 AT2G34910 AT2G35790 AT2G36620 AT2G37190 AT2G37270 AT2G37340 AT2G38020 AT2G38440 AT2G39120 AT2G39460 AT2G39725 AT2G39820 AT2G40010 AT2G40060 AT2G40430 AT2G42270 AT2G42510 AT2G42740 AT2G44860 AT2G45710 AT2G45990 AT2G46225 AT2G46280 AT2G46290 AT2G46455 AT2G47640 AT2G47690 AT3G02080 AT3G02200 AT3G03340 AT3G03420 AT3G03773 AT3G03970 AT3G04550 AT3G06320 AT3G07590 AT3G07920 AT3G08010 AT3G09480 AT3G10070 AT3G11070 AT3G11250 AT3G13210 AT3G13782 AT3G13940 AT3G15460 AT3G16010 AT3G17930 AT3G18310 AT3G22590 AT3G44160 AT3G45980 AT3G46030 AT3G46110 AT3G46610 AT3G46740 AT3G53020 AT3G53030 AT3G53650 AT3G53760 AT3G54710 AT3G55250 AT3G56160 AT3G56510 AT3G56910 AT3G57290 AT3G57370 AT3G60150 AT3G60740 AT3G61110 AT3G61650 AT4G01310 AT4G01400 AT4G02060 AT4G02450 AT4G02840 AT4G03120 AT4G04330 AT4G11420 AT4G13510 AT4G14110 AT4G18600 AT4G19100 AT4G19540 AT4G20260 AT4G22350 AT4G24690 AT4G26430 AT4G26965 AT4G28820 AT4G29350 AT4G31010 AT4G32820 AT4G34090 AT4G35540 AT4G35760 AT4G37200 AT4G37210 AT4G38510 AT4G38780 AT4G39160 AT4G39740 AT5G02120 AT5G02570 AT5G05520 AT5G05620 AT5G06000 AT5G06680 AT5G08780 AT5G09920 AT5G10710 AT5G11770 AT5G11900 AT5G15520 AT5G16690 AT5G17410 AT5G18410 AT5G18440 AT5G20920 AT5G20935 AT5G22330 AT5G22840 AT5G25450 AT5G27640 AT5G28740 AT5G38660 AT5G38720 AT5G40660 AT5G41520 AT5G41770 AT5G42270 AT5G44320 AT5G44635 AT5G45010 AT5G46400 AT5G49510 AT5G51110 AT5G51220 AT5G52110 AT5G52650 AT5G52980 AT5G54290 AT5G56280 AT5G57200 AT5G57320 AT5G58260 AT5G59910 AT5G60870 AT5G61770 AT5G62050 AT5G64270 AT5G65274 AT5G67490 ATCG00680 ATCG00840"
0.00386043917758329,91,186,1.39967498457026,"Ribonucleoprotein complex subunit organization "," http://amigo.geneontology.org/amigo/term/GO:0071826","AT1G03140 AT1G03530 AT1G04080 AT1G09150 AT1G10840 AT1G13030 AT1G14320 AT1G15440 AT1G16740 AT1G17070 AT1G17130 AT1G18540 AT1G20580 AT1G26910 AT1G32990 AT1G48920 AT1G52930 AT1G61580 AT1G66510 AT1G67440 AT1G72080 AT1G72370 AT1G74050 AT1G74060 AT1G76300 AT1G77840 AT1G80070 AT2G07725 AT2G18720 AT2G32050 AT2G32600 AT2G36620 AT2G37190 AT2G37270 AT2G37340 AT2G39460 AT2G39820 AT2G40010 AT2G40430 AT2G42270 AT2G42330 AT2G42510 AT2G42740 AT2G44860 AT2G45710 AT2G46280 AT2G46290 AT2G47640 AT3G02080 AT3G02200 AT3G03340 AT3G03970 AT3G06320 AT3G07590 AT3G07920 AT3G11250 AT3G13210 AT3G15460 AT3G22590 AT3G53020 AT3G53030 AT3G56160 AT3G56510 AT3G57290 AT3G61110 AT4G01310 AT4G02840 AT4G03120 AT4G11420 AT4G22350 AT4G28820 AT4G38780 AT5G06000 AT5G09920 AT5G11900 AT5G15520 AT5G18440 AT5G20920 AT5G22330 AT5G22840 AT5G27640 AT5G28740 AT5G38720 AT5G41520 AT5G41770 AT5G44320 AT5G46400 AT5G52650 AT5G61770 AT5G64270 ATCG00840"
0.00593442907759206,89,183,1.39135409203003,"Ribonucleoprotein complex assembly "," http://amigo.geneontology.org/amigo/term/GO:0022618","AT1G03140 AT1G03530 AT1G04080 AT1G09150 AT1G10840 AT1G13030 AT1G14320 AT1G15440 AT1G16740 AT1G17130 AT1G18540 AT1G20580 AT1G26910 AT1G32990 AT1G48920 AT1G52930 AT1G61580 AT1G66510 AT1G67440 AT1G72080 AT1G72370 AT1G74050 AT1G74060 AT1G76300 AT1G77840 AT1G80070 AT2G07725 AT2G18720 AT2G32050 AT2G32600 AT2G36620 AT2G37190 AT2G37270 AT2G37340 AT2G39460 AT2G39820 AT2G40010 AT2G40430 AT2G42270 AT2G42510 AT2G42740 AT2G44860 AT2G45710 AT2G46280 AT2G46290 AT2G47640 AT3G02080 AT3G02200 AT3G03340 AT3G03970 AT3G06320 AT3G07590 AT3G07920 AT3G11250 AT3G13210 AT3G15460 AT3G22590 AT3G53020 AT3G53030 AT3G56160 AT3G56510 AT3G57290 AT3G61110 AT4G01310 AT4G02840 AT4G03120 AT4G11420 AT4G22350 AT4G28820 AT4G38780 AT5G06000 AT5G09920 AT5G11900 AT5G15520 AT5G18440 AT5G20920 AT5G22330 AT5G22840 AT5G27640 AT5G28740 AT5G38720 AT5G41520 AT5G41770 AT5G44320 AT5G46400 AT5G52650 AT5G61770 AT5G64270 ATCG00840"
0.00762903437329662,124,270,1.31388294033897,"Establishment of protein localization to organelle "," http://amigo.geneontology.org/amigo/term/GO:0072594","AT1G01910 AT1G03000 AT1G04070 AT1G06950 AT1G09270 AT1G10390 AT1G13900 AT1G17530 AT1G20350 AT1G24310 AT1G26170 AT1G27310 AT1G27390 AT1G27970 AT1G32880 AT1G36390 AT1G48160 AT1G48635 AT1G48760 AT1G50400 AT1G53530 AT1G55540 AT1G61030 AT1G61570 AT1G63540 AT1G63900 AT1G64220 AT1G65080 AT1G66080 AT1G67680 AT1G72750 AT1G79280 AT1G79560 AT1G79810 AT2G15290 AT2G16640 AT2G19080 AT2G20890 AT2G24020 AT2G24820 AT2G29530 AT2G31530 AT2G34940 AT2G37410 AT2G37680 AT2G38410 AT2G41620 AT2G43640 AT2G45000 AT2G45790 AT2G45980 AT2G46455 AT3G01340 AT3G03490 AT3G05230 AT3G05720 AT3G07560 AT3G07910 AT3G08960 AT3G09700 AT3G10350 AT3G11070 AT3G14120 AT3G16310 AT3G20920 AT3G25120 AT3G44160 AT3G46740 AT3G47810 AT3G48870 AT3G49100 AT3G52850 AT3G53120 AT3G57350 AT3G59280 AT3G62880 AT3G63130 AT4G02510 AT4G08320 AT4G12760 AT4G15810 AT4G19003 AT4G20110 AT4G21180 AT4G21560 AT4G23940 AT4G24690 AT4G26780 AT4G27040 AT4G32910 AT4G35450 AT4G38560 AT4G40042 AT5G01590 AT5G03030 AT5G03070 AT5G03940 AT5G04920 AT5G05000 AT5G05520 AT5G05670 AT5G05680 AT5G11710 AT5G16830 AT5G17550 AT5G18525 AT5G20300 AT5G24650 AT5G27280 AT5G27430 AT5G39510 AT5G41685 AT5G43970 AT5G49500 AT5G49910 AT5G52440 AT5G55200 AT5G55500 AT5G56290 AT5G60730 AT5G62050 AT5G62810 AT5G66970 ATCG00860"
