"Enrichment FDR","nGenes","Pathway Genes","Fold Enrichment","Pathway","URL","Genes"
8.68229821127393e-08,254,530,1.37106043895993,"Intracellular protein transport "," http://amigo.geneontology.org/amigo/term/GO:0006886","AT1G01910 AT1G02430 AT1G02620 AT1G03000 AT1G04070 AT1G05520 AT1G06210 AT1G06950 AT1G08560 AT1G09270 AT1G09580 AT1G10390 AT1G10730 AT1G11250 AT1G11905 AT1G12360 AT1G12470 AT1G13900 AT1G14010 AT1G16240 AT1G16920 AT1G17530 AT1G20350 AT1G21380 AT1G21650 AT1G22860 AT1G23900 AT1G23935 AT1G24310 AT1G26170 AT1G27310 AT1G27390 AT1G27700 AT1G27970 AT1G32270 AT1G32880 AT1G33040 AT1G36390 AT1G48160 AT1G48440 AT1G48550 AT1G48635 AT1G48760 AT1G50400 AT1G50900 AT1G53530 AT1G55540 AT1G61570 AT1G63540 AT1G63900 AT1G64220 AT1G65080 AT1G66080 AT1G67680 AT1G69460 AT1G72750 AT1G73640 AT1G75850 AT1G79280 AT1G79560 AT1G79810 AT2G01110 AT2G03290 AT2G03820 AT2G15290 AT2G16640 AT2G17980 AT2G19080 AT2G20440 AT2G20760 AT2G20790 AT2G20890 AT2G20990 AT2G24020 AT2G24820 AT2G27460 AT2G29530 AT2G31530 AT2G32900 AT2G33640 AT2G34940 AT2G36360 AT2G37290 AT2G37410 AT2G37680 AT2G38020 AT2G38410 AT2G39280 AT2G40060 AT2G41620 AT2G42700 AT2G43490 AT2G43640 AT2G44610 AT2G45000 AT2G45790 AT2G45980 AT2G46455 AT3G01340 AT3G02460 AT3G03160 AT3G03490 AT3G03800 AT3G04970 AT3G05230 AT3G05710 AT3G05720 AT3G06540 AT3G07410 AT3G07560 AT3G07910 AT3G08530 AT3G08790 AT3G08960 AT3G09560 AT3G09700 AT3G09740 AT3G09800 AT3G09910 AT3G10350 AT3G10780 AT3G11070 AT3G11730 AT3G11820 AT3G12390 AT3G14120 AT3G16310 AT3G17780 AT3G18620 AT3G18820 AT3G20920 AT3G22180 AT3G22950 AT3G24350 AT3G25120 AT3G27530 AT3G44160 AT3G46740 AT3G47810 AT3G48870 AT3G49100 AT3G49470 AT3G50860 AT3G51310 AT3G51390 AT3G52850 AT3G53120 AT3G54860 AT3G55480 AT3G56190 AT3G56440 AT3G56450 AT3G56920 AT3G57350 AT3G59280 AT3G60800 AT3G62290 AT3G62880 AT3G63130 AT4G00840 AT4G01800 AT4G02195 AT4G02510 AT4G03330 AT4G08320 AT4G10480 AT4G12760 AT4G15810 AT4G17730 AT4G19003 AT4G20110 AT4G20410 AT4G21160 AT4G21180 AT4G21560 AT4G23460 AT4G23940 AT4G24550 AT4G24690 AT4G26780 AT4G27040 AT4G27100 AT4G27690 AT4G29950 AT4G31480 AT4G31740 AT4G32760 AT4G32910 AT4G35410 AT4G35450 AT4G38092 AT4G38490 AT4G40042 AT5G01590 AT5G01760 AT5G03030 AT5G03070 AT5G03340 AT5G03530 AT5G03940 AT5G04920 AT5G05000 AT5G05070 AT5G05520 AT5G05670 AT5G05680 AT5G05760 AT5G06120 AT5G10260 AT5G11710 AT5G13850 AT5G14670 AT5G16830 AT5G16880 AT5G17550 AT5G18525 AT5G20300 AT5G22780 AT5G24390 AT5G24650 AT5G26980 AT5G27280 AT5G27430 AT5G28350 AT5G28750 AT5G39510 AT5G41060 AT5G41685 AT5G43970 AT5G45750 AT5G46630 AT5G46860 AT5G47520 AT5G48660 AT5G49500 AT5G49910 AT5G51430 AT5G52210 AT5G52440 AT5G52580 AT5G53530 AT5G53570 AT5G55200 AT5G55500 AT5G56290 AT5G57210 AT5G60730 AT5G61010 AT5G62050 AT5G62810 AT5G63640 AT5G66160 AT5G66970 ATCG00860"
1.59415528574878e-07,161,311,1.48103130942161,"RNA modification "," http://amigo.geneontology.org/amigo/term/GO:0009451","AT1G01760 AT1G01860 AT1G03110 AT1G03530 AT1G03540 AT1G05750 AT1G06140 AT1G06560 AT1G09290 AT1G09800 AT1G10490 AT1G10910 AT1G11290 AT1G11430 AT1G11780 AT1G13870 AT1G14470 AT1G15480 AT1G22270 AT1G22830 AT1G25360 AT1G25410 AT1G29710 AT1G30550 AT1G31600 AT1G31790 AT1G45231 AT1G50000 AT1G51055 AT1G53260 AT1G56345 AT1G56570 AT1G59720 AT1G60230 AT1G66520 AT1G71460 AT1G71490 AT1G72090 AT1G74230 AT1G74600 AT1G75200 AT1G76050 AT1G76120 AT1G78190 AT1G78910 AT2G02750 AT2G02980 AT2G15690 AT2G15910 AT2G18410 AT2G20490 AT2G20540 AT2G22400 AT2G22410 AT2G25580 AT2G27610 AT2G27760 AT2G28450 AT2G40720 AT2G41750 AT2G44880 AT2G45270 AT2G45695 AT2G45730 AT2G46050 AT3G02010 AT3G02330 AT3G03920 AT3G04820 AT3G05240 AT3G06790 AT3G06950 AT3G09040 AT3G11220 AT3G11460 AT3G11800 AT3G12770 AT3G13770 AT3G13880 AT3G14140 AT3G14160 AT3G14330 AT3G18970 AT3G19630 AT3G20930 AT3G21300 AT3G25970 AT3G26410 AT3G26630 AT3G27180 AT3G44150 AT3G47840 AT3G49142 AT3G49640 AT3G52210 AT3G52260 AT3G56120 AT3G56330 AT3G56550 AT3G57430 AT3G57940 AT3G63370 AT3G63510 AT4G01880 AT4G09980 AT4G10130 AT4G10760 AT4G11690 AT4G14850 AT4G15520 AT4G17610 AT4G18520 AT4G18750 AT4G20020 AT4G20770 AT4G21300 AT4G21770 AT4G28020 AT4G31070 AT4G32450 AT4G34412 AT4G36390 AT4G38020 AT4G39530 AT4G40000 AT5G01230 AT5G08280 AT5G08490 AT5G09950 AT5G10070 AT5G10910 AT5G13680 AT5G14460 AT5G14600 AT5G15390 AT5G15810 AT5G16860 AT5G17660 AT5G24840 AT5G25030 AT5G26180 AT5G27110 AT5G35400 AT5G44780 AT5G47460 AT5G47680 AT5G47970 AT5G48910 AT5G50250 AT5G51130 AT5G51140 AT5G52470 AT5G52490 AT5G52850 AT5G54580 AT5G55130 AT5G57280 AT5G61030 AT5G66180 AT5G66520 AT5G67220"
3.30019518156133e-07,404,911,1.26870818253758,"Peptide metabolic process "," http://amigo.geneontology.org/amigo/term/GO:0006518","AT1G01100 AT1G01410 AT1G02140 AT1G02965 AT1G03360 AT1G06450 AT1G07070 AT1G07210 AT1G07830 AT1G08360 AT1G08845 AT1G09150 AT1G09620 AT1G09640 AT1G10840 AT1G11480 AT1G14205 AT1G14320 AT1G15250 AT1G15270 AT1G15280 AT1G15390 AT1G15810 AT1G15870 AT1G16720 AT1G16740 AT1G17220 AT1G17440 AT1G17560 AT1G17960 AT1G18540 AT1G19120 AT1G19550 AT1G19570 AT1G20340 AT1G21160 AT1G21760 AT1G22730 AT1G23290 AT1G23410 AT1G25350 AT1G26630 AT1G26740 AT1G26880 AT1G26910 AT1G27400 AT1G27890 AT1G27960 AT1G29880 AT1G30755 AT1G31500 AT1G32990 AT1G33980 AT1G34640 AT1G35730 AT1G44770 AT1G44780 AT1G44790 AT1G45332 AT1G47278 AT1G48350 AT1G48630 AT1G48830 AT1G48920 AT1G48970 AT1G51730 AT1G52325 AT1G52600 AT1G54290 AT1G54680 AT1G55500 AT1G56045 AT1G56350 AT1G59700 AT1G60080 AT1G61470 AT1G61580 AT1G62850 AT1G64510 AT1G64600 AT1G64790 AT1G66520 AT1G67430 AT1G67690 AT1G68420 AT1G68590 AT1G69820 AT1G70600 AT1G71080 AT1G71720 AT1G71770 AT1G72320 AT1G72370 AT1G72660 AT1G73990 AT1G74050 AT1G74060 AT1G74270 AT1G74310 AT1G74590 AT1G75270 AT1G75350 AT1G77290 AT1G77840 AT1G79090 AT1G79270 AT1G79850 AT1G80620 AT1G80720 AT1G80930 AT2G02390 AT2G04520 AT2G04842 AT2G05220 AT2G07725 AT2G09990 AT2G15910 AT2G17360 AT2G17640 AT2G18400 AT2G18720 AT2G19720 AT2G19730 AT2G20450 AT2G23350 AT2G24050 AT2G24060 AT2G25840 AT2G26920 AT2G27700 AT2G27710 AT2G29190 AT2G29420 AT2G29440 AT2G29470 AT2G29480 AT2G30870 AT2G31610 AT2G31920 AT2G32820 AT2G32940 AT2G33300 AT2G33450 AT2G33840 AT2G34530 AT2G34750 AT2G34970 AT2G36620 AT2G36660 AT2G37190 AT2G37270 AT2G38140 AT2G38560 AT2G39390 AT2G39460 AT2G39790 AT2G39795 AT2G39820 AT2G40010 AT2G40590 AT2G40780 AT2G41600 AT2G42740 AT2G42780 AT2G43310 AT2G44065 AT2G44070 AT2G44860 AT2G45710 AT2G45730 AT2G45810 AT2G46190 AT2G46280 AT2G46290 AT2G47090 AT2G47110 AT2G47570 AT2G47730 AT3G01150 AT3G01470 AT3G01790 AT3G01800 AT3G02080 AT3G02190 AT3G02200 AT3G02560 AT3G03190 AT3G03600 AT3G05230 AT3G05590 AT3G06320 AT3G06700 AT3G07750 AT3G07920 AT3G08010 AT3G09680 AT3G10360 AT3G10610 AT3G10820 AT3G10950 AT3G11250 AT3G11800 AT3G12930 AT3G12990 AT3G13460 AT3G13490 AT3G13640 AT3G13920 AT3G14080 AT3G15190 AT3G16040 AT3G17170 AT3G17465 AT3G17626 AT3G18240 AT3G18880 AT3G19760 AT3G20230 AT3G20250 AT3G20800 AT3G22270 AT3G22980 AT3G24170 AT3G24506 AT3G24590 AT3G24830 AT3G25920 AT3G26360 AT3G26400 AT3G26618 AT3G27730 AT3G28900 AT3G44150 AT3G44590 AT3G44740 AT3G45020 AT3G46040 AT3G46100 AT3G46610 AT3G48930 AT3G49010 AT3G49080 AT3G49100 AT3G53020 AT3G53870 AT3G55040 AT3G55170 AT3G55400 AT3G55605 AT3G56160 AT3G56300 AT3G56310 AT3G56910 AT3G57290 AT3G57490 AT3G58110 AT3G58140 AT3G58580 AT3G59410 AT3G59630 AT3G59650 AT3G59670 AT3G60500 AT3G60770 AT3G61110 AT3G61240 AT3G62120 AT3G62240 AT3G62250 AT3G62910 AT3G63140 AT3G63190 AT3G63490 AT4G00660 AT4G01310 AT4G02230 AT4G02520 AT4G04350 AT4G09012 AT4G10130 AT4G11420 AT4G13170 AT4G14320 AT4G16720 AT4G17300 AT4G17390 AT4G17560 AT4G19000 AT4G20330 AT4G21010 AT4G23620 AT4G25880 AT4G25890 AT4G26230 AT4G26300 AT4G26870 AT4G27090 AT4G27130 AT4G28365 AT4G29060 AT4G29410 AT4G30300 AT4G30680 AT4G30690 AT4G31290 AT4G31850 AT4G32175 AT4G33090 AT4G33410 AT4G34670 AT4G36130 AT4G37660 AT4G38090 AT4G39630 AT4G39640 AT4G40042 AT5G01230 AT5G02050 AT5G02160 AT5G02610 AT5G02790 AT5G02960 AT5G03406 AT5G03880 AT5G04800 AT5G05470 AT5G05990 AT5G06000 AT5G06370 AT5G08550 AT5G08650 AT5G09850 AT5G09920 AT5G10360 AT5G10540 AT5G10880 AT5G10900 AT5G11430 AT5G11900 AT5G12110 AT5G12120 AT5G12980 AT5G13510 AT5G13570 AT5G14660 AT5G15520 AT5G15760 AT5G16130 AT5G17220 AT5G18110 AT5G18380 AT5G18410 AT5G19485 AT5G19510 AT5G20180 AT5G20920 AT5G23535 AT5G23900 AT5G24490 AT5G25520 AT5G26710 AT5G27430 AT5G27470 AT5G27640 AT5G27850 AT5G35680 AT5G36170 AT5G39800 AT5G39930 AT5G41250 AT5G42180 AT5G42310 AT5G44000 AT5G44320 AT5G45000 AT5G45020 AT5G47190 AT5G47700 AT5G47880 AT5G49030 AT5G51220 AT5G53330 AT5G54600 AT5G56120 AT5G56710 AT5G56940 AT5G57650 AT5G58620 AT5G59240 AT5G60110 AT5G60180 AT5G60960 AT5G61020 AT5G61770 AT5G62480 AT5G63300 AT5G64490 AT5G65540 AT5G65620 AT5G67510 ATCG00050 ATCG00830 ATCG00840 ATCG01020"
4.42889714044606e-07,176,350,1.43861099826977,"RNA splicing "," http://amigo.geneontology.org/amigo/term/GO:0008380","AT1G01350 AT1G02140 AT1G02330 AT1G03140 AT1G03330 AT1G04080 AT1G06790 AT1G06960 AT1G07170 AT1G09140 AT1G09760 AT1G09770 AT1G10320 AT1G10580 AT1G11520 AT1G13030 AT1G15280 AT1G17070 AT1G17130 AT1G20580 AT1G20920 AT1G21190 AT1G23400 AT1G27650 AT1G28060 AT1G30010 AT1G30480 AT1G31870 AT1G33520 AT1G44910 AT1G51965 AT1G56290 AT1G60650 AT1G66510 AT1G71310 AT1G72080 AT1G73720 AT1G74120 AT1G74900 AT1G76300 AT1G76860 AT1G79100 AT1G80060 AT1G80070 AT1G80930 AT2G17520 AT2G27100 AT2G32050 AT2G32600 AT2G37340 AT2G38610 AT2G38770 AT2G39120 AT2G39340 AT2G40650 AT2G41500 AT2G42270 AT2G42330 AT2G42510 AT2G43410 AT2G44200 AT2G45330 AT2G46200 AT2G46610 AT2G47580 AT2G47640 AT3G01150 AT3G01370 AT3G02370 AT3G03340 AT3G03970 AT3G05760 AT3G07590 AT3G07860 AT3G08620 AT3G09160 AT3G10400 AT3G11960 AT3G13210 AT3G13570 AT3G16010 AT3G16650 AT3G18610 AT3G19760 AT3G19840 AT3G22330 AT3G23070 AT3G23990 AT3G24730 AT3G27750 AT3G32940 AT3G44785 AT3G45180 AT3G45590 AT3G47120 AT3G53030 AT3G53500 AT3G53640 AT3G55935 AT3G57360 AT3G59810 AT3G61360 AT3G61860 AT3G62310 AT3G63400 AT4G01037 AT4G01400 AT4G02430 AT4G02840 AT4G02990 AT4G03120 AT4G08580 AT4G11970 AT4G12600 AT4G12640 AT4G14300 AT4G14510 AT4G16680 AT4G18465 AT4G18520 AT4G20030 AT4G22350 AT4G24500 AT4G25500 AT4G26480 AT4G31010 AT4G33360 AT4G33370 AT4G34140 AT4G37120 AT4G38590 AT4G38780 AT5G04050 AT5G04430 AT5G05720 AT5G06420 AT5G08290 AT5G08550 AT5G09210 AT5G09860 AT5G10800 AT5G11200 AT5G13010 AT5G16140 AT5G16260 AT5G16780 AT5G19210 AT5G22840 AT5G23600 AT5G24360 AT5G25060 AT5G25340 AT5G26742 AT5G28740 AT5G39930 AT5G41690 AT5G41770 AT5G42300 AT5G42820 AT5G44500 AT5G46400 AT5G46920 AT5G48870 AT5G51280 AT5G52040 AT5G56130 AT5G56140 AT5G56900 AT5G57370 AT5G58020 AT5G60230 AT5G60870 AT5G61140 AT5G63370 AT5G64200 AT5G64270"
4.69123571554999e-07,361,805,1.28295101377319,"Translation "," http://amigo.geneontology.org/amigo/term/GO:0006412","AT1G01100 AT1G01410 AT1G02140 AT1G03360 AT1G06450 AT1G07070 AT1G07210 AT1G07830 AT1G08360 AT1G08845 AT1G09150 AT1G09620 AT1G09640 AT1G10840 AT1G11480 AT1G14205 AT1G14320 AT1G15250 AT1G15270 AT1G15280 AT1G15390 AT1G15810 AT1G15870 AT1G16720 AT1G16740 AT1G17220 AT1G17440 AT1G17560 AT1G17960 AT1G18540 AT1G19120 AT1G20340 AT1G21160 AT1G21760 AT1G22730 AT1G23290 AT1G23410 AT1G25350 AT1G26630 AT1G26740 AT1G26880 AT1G26910 AT1G27400 AT1G27890 AT1G27960 AT1G29880 AT1G30755 AT1G31500 AT1G32990 AT1G33980 AT1G35730 AT1G44770 AT1G44780 AT1G45332 AT1G47278 AT1G48350 AT1G48630 AT1G48830 AT1G48920 AT1G48970 AT1G51730 AT1G52325 AT1G54290 AT1G54680 AT1G55500 AT1G56045 AT1G56350 AT1G60080 AT1G61470 AT1G61580 AT1G62850 AT1G64510 AT1G64600 AT1G64790 AT1G66520 AT1G67430 AT1G68420 AT1G68590 AT1G69820 AT1G70600 AT1G71080 AT1G71720 AT1G71770 AT1G72320 AT1G72370 AT1G72660 AT1G74050 AT1G74060 AT1G74270 AT1G74310 AT1G75350 AT1G77840 AT1G79090 AT1G79270 AT1G79850 AT1G80620 AT1G80720 AT1G80930 AT2G04520 AT2G04842 AT2G05220 AT2G07725 AT2G09990 AT2G15910 AT2G17360 AT2G18400 AT2G18720 AT2G19720 AT2G19730 AT2G20450 AT2G23350 AT2G24050 AT2G24060 AT2G25840 AT2G26920 AT2G27700 AT2G27710 AT2G29190 AT2G31610 AT2G31920 AT2G32820 AT2G32940 AT2G33300 AT2G33450 AT2G33840 AT2G34530 AT2G34750 AT2G34970 AT2G36620 AT2G36660 AT2G37190 AT2G37270 AT2G38140 AT2G38560 AT2G39390 AT2G39460 AT2G39790 AT2G39795 AT2G39820 AT2G40010 AT2G40590 AT2G40780 AT2G41600 AT2G42740 AT2G42780 AT2G43310 AT2G44065 AT2G44070 AT2G44860 AT2G45710 AT2G45730 AT2G45810 AT2G46190 AT2G46280 AT2G46290 AT2G47090 AT2G47110 AT2G47570 AT3G01150 AT3G01470 AT3G01790 AT3G01800 AT3G02080 AT3G02190 AT3G02200 AT3G02560 AT3G03600 AT3G05590 AT3G06320 AT3G06700 AT3G07750 AT3G07920 AT3G08010 AT3G09680 AT3G10360 AT3G10610 AT3G10820 AT3G10950 AT3G11250 AT3G11800 AT3G12930 AT3G12990 AT3G13460 AT3G13490 AT3G13640 AT3G13920 AT3G14080 AT3G15190 AT3G16040 AT3G17170 AT3G17465 AT3G17626 AT3G18240 AT3G18880 AT3G19760 AT3G20230 AT3G20250 AT3G20800 AT3G22270 AT3G22980 AT3G24506 AT3G24830 AT3G25920 AT3G26360 AT3G26400 AT3G26618 AT3G27730 AT3G28900 AT3G44150 AT3G44590 AT3G44740 AT3G45020 AT3G46040 AT3G46100 AT3G46610 AT3G48930 AT3G49010 AT3G49080 AT3G49100 AT3G53020 AT3G53870 AT3G55170 AT3G55400 AT3G55605 AT3G56160 AT3G56300 AT3G56310 AT3G56910 AT3G57290 AT3G57490 AT3G58110 AT3G58140 AT3G58580 AT3G59410 AT3G59630 AT3G59650 AT3G59670 AT3G60500 AT3G60770 AT3G61110 AT3G61240 AT3G62120 AT3G62240 AT3G62250 AT3G62910 AT3G63140 AT3G63190 AT3G63490 AT4G00660 AT4G01310 AT4G02230 AT4G04350 AT4G09012 AT4G10130 AT4G11420 AT4G13170 AT4G14320 AT4G16720 AT4G17300 AT4G17390 AT4G17560 AT4G19000 AT4G20330 AT4G21010 AT4G23620 AT4G25880 AT4G25890 AT4G26230 AT4G26300 AT4G26870 AT4G27090 AT4G27130 AT4G28365 AT4G29060 AT4G29410 AT4G30300 AT4G30680 AT4G30690 AT4G31850 AT4G32175 AT4G34670 AT4G36130 AT4G37660 AT4G38090 AT4G39630 AT4G39640 AT5G01230 AT5G02050 AT5G02160 AT5G02610 AT5G02960 AT5G03406 AT5G04800 AT5G05470 AT5G05990 AT5G06000 AT5G08550 AT5G08650 AT5G09850 AT5G09920 AT5G10360 AT5G10880 AT5G10900 AT5G11430 AT5G11900 AT5G12110 AT5G12120 AT5G12980 AT5G13510 AT5G13570 AT5G14660 AT5G15520 AT5G15760 AT5G16130 AT5G18110 AT5G18380 AT5G18410 AT5G19485 AT5G19510 AT5G20180 AT5G20920 AT5G23535 AT5G23900 AT5G24490 AT5G25520 AT5G26710 AT5G27470 AT5G27640 AT5G27850 AT5G35680 AT5G36170 AT5G39800 AT5G39930 AT5G42310 AT5G44320 AT5G47190 AT5G47700 AT5G47880 AT5G49030 AT5G51220 AT5G53330 AT5G54600 AT5G56120 AT5G56710 AT5G56940 AT5G57650 AT5G58620 AT5G59240 AT5G60110 AT5G60180 AT5G60960 AT5G61020 AT5G61770 AT5G63300 AT5G64490 AT5G65540 AT5G67510 ATCG00050 ATCG00830 ATCG00840 ATCG01020"
4.69123571554999e-07,138,262,1.50687264088371,"RNA splicing, via transesterification reactions "," http://amigo.geneontology.org/amigo/term/GO:0000375","AT1G02330 AT1G03140 AT1G03330 AT1G04080 AT1G06960 AT1G07170 AT1G09140 AT1G09760 AT1G09770 AT1G10320 AT1G10580 AT1G11520 AT1G13030 AT1G17070 AT1G17130 AT1G20580 AT1G20920 AT1G21190 AT1G23400 AT1G27650 AT1G28060 AT1G30010 AT1G30480 AT1G31870 AT1G33520 AT1G44910 AT1G56290 AT1G60650 AT1G66510 AT1G71310 AT1G72080 AT1G76300 AT1G76860 AT1G79100 AT1G80060 AT1G80070 AT1G80930 AT2G27100 AT2G32050 AT2G32600 AT2G37340 AT2G38610 AT2G38770 AT2G39120 AT2G39340 AT2G40650 AT2G41500 AT2G42270 AT2G42330 AT2G42510 AT2G43410 AT2G44200 AT2G46610 AT2G47580 AT2G47640 AT3G01150 AT3G01370 AT3G03340 AT3G03970 AT3G05760 AT3G07590 AT3G07860 AT3G08620 AT3G09160 AT3G10400 AT3G11960 AT3G13210 AT3G13570 AT3G16010 AT3G16650 AT3G18610 AT3G22330 AT3G23070 AT3G23990 AT3G24730 AT3G27750 AT3G32940 AT3G44785 AT3G45180 AT3G47120 AT3G53030 AT3G53500 AT3G53640 AT3G55935 AT3G59810 AT3G61360 AT3G61860 AT4G01037 AT4G01400 AT4G02430 AT4G02840 AT4G03120 AT4G08580 AT4G11970 AT4G12600 AT4G12640 AT4G14510 AT4G20030 AT4G22350 AT4G24500 AT4G25500 AT4G26480 AT4G31010 AT4G33360 AT4G33370 AT4G34140 AT4G37120 AT4G38590 AT4G38780 AT5G04050 AT5G05720 AT5G08290 AT5G08550 AT5G09210 AT5G13010 AT5G16260 AT5G16780 AT5G19210 AT5G22840 AT5G25340 AT5G26742 AT5G28740 AT5G41690 AT5G41770 AT5G42300 AT5G42820 AT5G44500 AT5G46400 AT5G46920 AT5G48870 AT5G51280 AT5G52040 AT5G56140 AT5G56900 AT5G58020 AT5G63370 AT5G64200 AT5G64270"
4.69123571554999e-07,138,262,1.50687264088371,"RNA splicing, via transesterification reactions with bulged adenosine as nucleophile "," http://amigo.geneontology.org/amigo/term/GO:0000377","AT1G02330 AT1G03140 AT1G03330 AT1G04080 AT1G06960 AT1G07170 AT1G09140 AT1G09760 AT1G09770 AT1G10320 AT1G10580 AT1G11520 AT1G13030 AT1G17070 AT1G17130 AT1G20580 AT1G20920 AT1G21190 AT1G23400 AT1G27650 AT1G28060 AT1G30010 AT1G30480 AT1G31870 AT1G33520 AT1G44910 AT1G56290 AT1G60650 AT1G66510 AT1G71310 AT1G72080 AT1G76300 AT1G76860 AT1G79100 AT1G80060 AT1G80070 AT1G80930 AT2G27100 AT2G32050 AT2G32600 AT2G37340 AT2G38610 AT2G38770 AT2G39120 AT2G39340 AT2G40650 AT2G41500 AT2G42270 AT2G42330 AT2G42510 AT2G43410 AT2G44200 AT2G46610 AT2G47580 AT2G47640 AT3G01150 AT3G01370 AT3G03340 AT3G03970 AT3G05760 AT3G07590 AT3G07860 AT3G08620 AT3G09160 AT3G10400 AT3G11960 AT3G13210 AT3G13570 AT3G16010 AT3G16650 AT3G18610 AT3G22330 AT3G23070 AT3G23990 AT3G24730 AT3G27750 AT3G32940 AT3G44785 AT3G45180 AT3G47120 AT3G53030 AT3G53500 AT3G53640 AT3G55935 AT3G59810 AT3G61360 AT3G61860 AT4G01037 AT4G01400 AT4G02430 AT4G02840 AT4G03120 AT4G08580 AT4G11970 AT4G12600 AT4G12640 AT4G14510 AT4G20030 AT4G22350 AT4G24500 AT4G25500 AT4G26480 AT4G31010 AT4G33360 AT4G33370 AT4G34140 AT4G37120 AT4G38590 AT4G38780 AT5G04050 AT5G05720 AT5G08290 AT5G08550 AT5G09210 AT5G13010 AT5G16260 AT5G16780 AT5G19210 AT5G22840 AT5G25340 AT5G26742 AT5G28740 AT5G41690 AT5G41770 AT5G42300 AT5G42820 AT5G44500 AT5G46400 AT5G46920 AT5G48870 AT5G51280 AT5G52040 AT5G56140 AT5G56900 AT5G58020 AT5G63370 AT5G64200 AT5G64270"
5.47322544340912e-07,362,809,1.28014393106514,"Peptide biosynthetic process "," http://amigo.geneontology.org/amigo/term/GO:0043043","AT1G01100 AT1G01410 AT1G02140 AT1G03360 AT1G06450 AT1G07070 AT1G07210 AT1G07830 AT1G08360 AT1G08845 AT1G09150 AT1G09620 AT1G09640 AT1G10840 AT1G11480 AT1G14205 AT1G14320 AT1G15250 AT1G15270 AT1G15280 AT1G15390 AT1G15810 AT1G15870 AT1G16720 AT1G16740 AT1G17220 AT1G17440 AT1G17560 AT1G17960 AT1G18540 AT1G19120 AT1G20340 AT1G21160 AT1G21760 AT1G22730 AT1G23290 AT1G23410 AT1G25350 AT1G26630 AT1G26740 AT1G26880 AT1G26910 AT1G27400 AT1G27890 AT1G27960 AT1G29880 AT1G30755 AT1G31500 AT1G32990 AT1G33980 AT1G35730 AT1G44770 AT1G44780 AT1G45332 AT1G47278 AT1G48350 AT1G48630 AT1G48830 AT1G48920 AT1G48970 AT1G51730 AT1G52325 AT1G54290 AT1G54680 AT1G55500 AT1G56045 AT1G56350 AT1G60080 AT1G61470 AT1G61580 AT1G62850 AT1G64510 AT1G64600 AT1G64790 AT1G66520 AT1G67430 AT1G68420 AT1G68590 AT1G69820 AT1G70600 AT1G71080 AT1G71720 AT1G71770 AT1G72320 AT1G72370 AT1G72660 AT1G74050 AT1G74060 AT1G74270 AT1G74310 AT1G75350 AT1G77840 AT1G79090 AT1G79270 AT1G79850 AT1G80620 AT1G80720 AT1G80930 AT2G04520 AT2G04842 AT2G05220 AT2G07725 AT2G09990 AT2G15910 AT2G17360 AT2G18400 AT2G18720 AT2G19720 AT2G19730 AT2G20450 AT2G23350 AT2G24050 AT2G24060 AT2G25840 AT2G26920 AT2G27700 AT2G27710 AT2G29190 AT2G31610 AT2G31920 AT2G32820 AT2G32940 AT2G33300 AT2G33450 AT2G33840 AT2G34530 AT2G34750 AT2G34970 AT2G36620 AT2G36660 AT2G37190 AT2G37270 AT2G38140 AT2G38560 AT2G39390 AT2G39460 AT2G39790 AT2G39795 AT2G39820 AT2G40010 AT2G40590 AT2G40780 AT2G41600 AT2G42740 AT2G42780 AT2G43310 AT2G44065 AT2G44070 AT2G44860 AT2G45710 AT2G45730 AT2G45810 AT2G46190 AT2G46280 AT2G46290 AT2G47090 AT2G47110 AT2G47570 AT3G01150 AT3G01470 AT3G01790 AT3G01800 AT3G02080 AT3G02190 AT3G02200 AT3G02560 AT3G03600 AT3G05590 AT3G06320 AT3G06700 AT3G07750 AT3G07920 AT3G08010 AT3G09680 AT3G10360 AT3G10610 AT3G10820 AT3G10950 AT3G11250 AT3G11800 AT3G12930 AT3G12990 AT3G13460 AT3G13490 AT3G13640 AT3G13920 AT3G14080 AT3G15190 AT3G16040 AT3G17170 AT3G17465 AT3G17626 AT3G18240 AT3G18880 AT3G19760 AT3G20230 AT3G20250 AT3G20800 AT3G22270 AT3G22980 AT3G24506 AT3G24830 AT3G25920 AT3G26360 AT3G26400 AT3G26618 AT3G27730 AT3G28900 AT3G44150 AT3G44590 AT3G44740 AT3G45020 AT3G46040 AT3G46100 AT3G46610 AT3G48930 AT3G49010 AT3G49080 AT3G49100 AT3G53020 AT3G53870 AT3G55170 AT3G55400 AT3G55605 AT3G56160 AT3G56300 AT3G56310 AT3G56910 AT3G57290 AT3G57490 AT3G58110 AT3G58140 AT3G58580 AT3G59410 AT3G59630 AT3G59650 AT3G59670 AT3G60500 AT3G60770 AT3G61110 AT3G61240 AT3G62120 AT3G62240 AT3G62250 AT3G62910 AT3G63140 AT3G63190 AT3G63490 AT4G00660 AT4G01310 AT4G02230 AT4G04350 AT4G09012 AT4G10130 AT4G11420 AT4G13170 AT4G14320 AT4G16720 AT4G17300 AT4G17390 AT4G17560 AT4G19000 AT4G20330 AT4G21010 AT4G23620 AT4G25880 AT4G25890 AT4G26230 AT4G26300 AT4G26870 AT4G27090 AT4G27130 AT4G28365 AT4G29060 AT4G29410 AT4G30300 AT4G30680 AT4G30690 AT4G31850 AT4G32175 AT4G34670 AT4G36130 AT4G37660 AT4G38090 AT4G39630 AT4G39640 AT5G01230 AT5G02050 AT5G02160 AT5G02610 AT5G02960 AT5G03406 AT5G04800 AT5G05470 AT5G05990 AT5G06000 AT5G06370 AT5G08550 AT5G08650 AT5G09850 AT5G09920 AT5G10360 AT5G10880 AT5G10900 AT5G11430 AT5G11900 AT5G12110 AT5G12120 AT5G12980 AT5G13510 AT5G13570 AT5G14660 AT5G15520 AT5G15760 AT5G16130 AT5G18110 AT5G18380 AT5G18410 AT5G19485 AT5G19510 AT5G20180 AT5G20920 AT5G23535 AT5G23900 AT5G24490 AT5G25520 AT5G26710 AT5G27470 AT5G27640 AT5G27850 AT5G35680 AT5G36170 AT5G39800 AT5G39930 AT5G42310 AT5G44320 AT5G47190 AT5G47700 AT5G47880 AT5G49030 AT5G51220 AT5G53330 AT5G54600 AT5G56120 AT5G56710 AT5G56940 AT5G57650 AT5G58620 AT5G59240 AT5G60110 AT5G60180 AT5G60960 AT5G61020 AT5G61770 AT5G63300 AT5G64490 AT5G65540 AT5G67510 ATCG00050 ATCG00830 ATCG00840 ATCG01020"
8.67469229569626e-07,437,1003,1.24646261321355,"Cellular localization "," http://amigo.geneontology.org/amigo/term/GO:0051641","AT1G01910 AT1G01950 AT1G02130 AT1G02430 AT1G02620 AT1G03000 AT1G03050 AT1G03140 AT1G03360 AT1G03950 AT1G04070 AT1G04600 AT1G04750 AT1G05520 AT1G06210 AT1G06950 AT1G08350 AT1G08400 AT1G08560 AT1G09270 AT1G09580 AT1G10390 AT1G10430 AT1G10730 AT1G10950 AT1G11250 AT1G11890 AT1G11905 AT1G12150 AT1G12360 AT1G12470 AT1G13160 AT1G13900 AT1G14010 AT1G14670 AT1G15880 AT1G16240 AT1G16920 AT1G17530 AT1G17580 AT1G17730 AT1G18910 AT1G19970 AT1G20350 AT1G20760 AT1G21170 AT1G21380 AT1G21650 AT1G22860 AT1G23900 AT1G23935 AT1G24100 AT1G24310 AT1G24490 AT1G24560 AT1G26170 AT1G27310 AT1G27390 AT1G27695 AT1G27700 AT1G27970 AT1G29330 AT1G30630 AT1G30890 AT1G32270 AT1G32880 AT1G33040 AT1G36390 AT1G43700 AT1G45545 AT1G47550 AT1G48160 AT1G48440 AT1G48550 AT1G48635 AT1G48760 AT1G50400 AT1G50500 AT1G50900 AT1G51160 AT1G53530 AT1G55130 AT1G55540 AT1G59820 AT1G61030 AT1G61570 AT1G63540 AT1G63900 AT1G64220 AT1G64750 AT1G65080 AT1G66080 AT1G66840 AT1G67680 AT1G69460 AT1G71270 AT1G71300 AT1G72320 AT1G72750 AT1G73030 AT1G73640 AT1G73790 AT1G74770 AT1G75850 AT1G76750 AT1G76850 AT1G77220 AT1G77460 AT1G79280 AT1G79560 AT1G79810 AT1G80670 AT1G80680 AT2G01110 AT2G01470 AT2G01770 AT2G01970 AT2G03290 AT2G03820 AT2G15290 AT2G16640 AT2G17940 AT2G17980 AT2G18240 AT2G19080 AT2G20440 AT2G20760 AT2G20790 AT2G20890 AT2G20990 AT2G21600 AT2G21740 AT2G21750 AT2G22125 AT2G24020 AT2G24820 AT2G27460 AT2G27600 AT2G27900 AT2G29530 AT2G31260 AT2G31530 AT2G31900 AT2G32415 AT2G32900 AT2G33240 AT2G33640 AT2G34940 AT2G36305 AT2G36360 AT2G37290 AT2G37410 AT2G37680 AT2G37990 AT2G38020 AT2G38370 AT2G38410 AT2G39280 AT2G39820 AT2G40060 AT2G40300 AT2G40810 AT2G41620 AT2G42700 AT2G43490 AT2G43640 AT2G44610 AT2G44640 AT2G45000 AT2G45790 AT2G45820 AT2G45980 AT2G46180 AT2G46455 AT3G01340 AT3G02460 AT3G03160 AT3G03272 AT3G03490 AT3G03800 AT3G04970 AT3G05000 AT3G05230 AT3G05710 AT3G05720 AT3G06290 AT3G06540 AT3G06960 AT3G07160 AT3G07410 AT3G07560 AT3G07910 AT3G08530 AT3G08790 AT3G08960 AT3G09560 AT3G09700 AT3G09740 AT3G09800 AT3G09900 AT3G09910 AT3G10350 AT3G10780 AT3G11070 AT3G11730 AT3G11780 AT3G11820 AT3G12390 AT3G13640 AT3G13772 AT3G13870 AT3G14120 AT3G16310 AT3G17780 AT3G18620 AT3G18820 AT3G20430 AT3G20920 AT3G22180 AT3G22950 AT3G24350 AT3G25120 AT3G27240 AT3G27530 AT3G27700 AT3G44160 AT3G46740 AT3G47810 AT3G48870 AT3G49100 AT3G49155 AT3G49470 AT3G49990 AT3G50860 AT3G51310 AT3G51390 AT3G52140 AT3G52850 AT3G53110 AT3G53120 AT3G53610 AT3G54085 AT3G54860 AT3G54870 AT3G55480 AT3G56190 AT3G56270 AT3G56440 AT3G56450 AT3G56900 AT3G56920 AT3G57350 AT3G58160 AT3G59280 AT3G59500 AT3G60800 AT3G61570 AT3G61650 AT3G62080 AT3G62290 AT3G62880 AT3G63130 AT3G63480 AT4G00840 AT4G01800 AT4G02195 AT4G02510 AT4G03330 AT4G08320 AT4G10480 AT4G11790 AT4G12650 AT4G12760 AT4G13350 AT4G14330 AT4G15810 AT4G15890 AT4G17170 AT4G17730 AT4G19003 AT4G19490 AT4G20110 AT4G20410 AT4G21160 AT4G21180 AT4G21560 AT4G21820 AT4G23460 AT4G23940 AT4G24550 AT4G24690 AT4G24880 AT4G26020 AT4G26780 AT4G27040 AT4G27100 AT4G27370 AT4G27690 AT4G28280 AT4G29350 AT4G29950 AT4G30300 AT4G31480 AT4G31520 AT4G31740 AT4G32175 AT4G32560 AT4G32760 AT4G32910 AT4G35410 AT4G35450 AT4G38092 AT4G38360 AT4G38490 AT4G38560 AT4G38790 AT4G39220 AT4G39990 AT4G40042 AT5G01590 AT5G01600 AT5G01760 AT5G02280 AT5G02770 AT5G03030 AT5G03070 AT5G03340 AT5G03520 AT5G03530 AT5G03830 AT5G03940 AT5G04850 AT5G04920 AT5G05000 AT5G05010 AT5G05070 AT5G05520 AT5G05620 AT5G05670 AT5G05680 AT5G05760 AT5G06120 AT5G06970 AT5G07120 AT5G07590 AT5G08680 AT5G09260 AT5G09860 AT5G09920 AT5G10260 AT5G10470 AT5G10840 AT5G11630 AT5G11710 AT5G12370 AT5G13530 AT5G13850 AT5G14670 AT5G16830 AT5G16850 AT5G16880 AT5G17340 AT5G17410 AT5G17550 AT5G18525 AT5G20300 AT5G20490 AT5G20610 AT5G21050 AT5G22780 AT5G24290 AT5G24380 AT5G24390 AT5G24650 AT5G25260 AT5G26980 AT5G27280 AT5G27430 AT5G27550 AT5G28350 AT5G28750 AT5G38150 AT5G39510 AT5G40810 AT5G41060 AT5G41685 AT5G42890 AT5G42895 AT5G43970 AT5G44495 AT5G45010 AT5G45750 AT5G46330 AT5G46630 AT5G46860 AT5G47520 AT5G48210 AT5G48660 AT5G49500 AT5G49830 AT5G49880 AT5G49910 AT5G51105 AT5G51430 AT5G52210 AT5G52440 AT5G52580 AT5G53530 AT5G53570 AT5G54062 AT5G54280 AT5G54440 AT5G54750 AT5G55200 AT5G55500 AT5G56130 AT5G56290 AT5G57210 AT5G58030 AT5G58140 AT5G59840 AT5G60730 AT5G60964 AT5G61010 AT5G61130 AT5G62050 AT5G62810 AT5G63220 AT5G63640 AT5G63880 AT5G64720 AT5G64870 AT5G65950 AT5G66160 AT5G66970 ATCG00480 ATCG00860"
