"Enrichment FDR","nGenes","Pathway Genes","Fold Enrichment","Pathway","URL","Genes"
2.23732541534815e-18,486,979,1.42020922790932,"RNA processing "," http://amigo.geneontology.org/amigo/term/GO:0006396","AT1G01040 AT1G01210 AT1G01350 AT1G01760 AT1G01860 AT1G02140 AT1G02330 AT1G03110 AT1G03140 AT1G03330 AT1G03360 AT1G03687 AT1G04080 AT1G04230 AT1G04530 AT1G04635 AT1G04640 AT1G06560 AT1G06790 AT1G06960 AT1G07170 AT1G08360 AT1G08410 AT1G09140 AT1G09290 AT1G09700 AT1G09760 AT1G09770 AT1G09800 AT1G10320 AT1G10490 AT1G10580 AT1G11290 AT1G11430 AT1G11520 AT1G11650 AT1G12300 AT1G12650 AT1G12780 AT1G13030 AT1G13870 AT1G14790 AT1G15280 AT1G15420 AT1G15440 AT1G16280 AT1G17070 AT1G17130 AT1G17370 AT1G17760 AT1G17980 AT1G19120 AT1G20580 AT1G20920 AT1G21190 AT1G22270 AT1G22660 AT1G23280 AT1G23400 AT1G25410 AT1G26530 AT1G26550 AT1G27650 AT1G28060 AT1G30010 AT1G30480 AT1G30550 AT1G31600 AT1G31870 AT1G31970 AT1G33520 AT1G44910 AT1G45231 AT1G47500 AT1G48830 AT1G48920 AT1G49540 AT1G49970 AT1G50000 AT1G51055 AT1G51965 AT1G52930 AT1G53260 AT1G55140 AT1G55150 AT1G55870 AT1G56290 AT1G56310 AT1G59720 AT1G59760 AT1G60080 AT1G60230 AT1G60650 AT1G61010 AT1G63180 AT1G63980 AT1G66260 AT1G66500 AT1G66510 AT1G66520 AT1G69070 AT1G71310 AT1G71800 AT1G72080 AT1G72090 AT1G72320 AT1G73720 AT1G73840 AT1G74120 AT1G74230 AT1G74700 AT1G74900 AT1G75200 AT1G75660 AT1G76050 AT1G76120 AT1G76300 AT1G76860 AT1G78190 AT1G78910 AT1G79090 AT1G79100 AT1G79880 AT1G80060 AT1G80070 AT1G80650 AT1G80750 AT1G80930 AT2G01640 AT2G01730 AT2G02570 AT2G02980 AT2G04270 AT2G04530 AT2G06990 AT2G09990 AT2G15910 AT2G17510 AT2G17520 AT2G18410 AT2G19930 AT2G20490 AT2G22400 AT2G24350 AT2G25850 AT2G25870 AT2G27100 AT2G27760 AT2G28230 AT2G28380 AT2G28450 AT2G29760 AT2G31890 AT2G32050 AT2G32415 AT2G32600 AT2G32940 AT2G34570 AT2G37340 AT2G37990 AT2G38610 AT2G38770 AT2G39120 AT2G39340 AT2G39390 AT2G39740 AT2G39820 AT2G40430 AT2G40650 AT2G41500 AT2G41750 AT2G42270 AT2G42330 AT2G42510 AT2G42650 AT2G43190 AT2G43410 AT2G43650 AT2G44200 AT2G45270 AT2G45330 AT2G45695 AT2G45730 AT2G45810 AT2G46020 AT2G46050 AT2G46200 AT2G46230 AT2G46610 AT2G47580 AT2G47640 AT2G47990 AT2G48100 AT3G01150 AT3G01160 AT3G01370 AT3G02330 AT3G02370 AT3G02560 AT3G03340 AT3G03920 AT3G03970 AT3G05760 AT3G06290 AT3G06790 AT3G06950 AT3G07170 AT3G07530 AT3G07590 AT3G07610 AT3G07750 AT3G07860 AT3G08620 AT3G09160 AT3G09650 AT3G09720 AT3G10400 AT3G11220 AT3G11460 AT3G11800 AT3G11960 AT3G12640 AT3G12990 AT3G13210 AT3G13290 AT3G13570 AT3G13580 AT3G14080 AT3G14100 AT3G15080 AT3G15390 AT3G15460 AT3G16010 AT3G16260 AT3G16650 AT3G17740 AT3G18610 AT3G18680 AT3G19630 AT3G19760 AT3G19840 AT3G20420 AT3G20930 AT3G21300 AT3G22270 AT3G22330 AT3G22510 AT3G22590 AT3G22660 AT3G22680 AT3G23070 AT3G23780 AT3G23990 AT3G24506 AT3G24560 AT3G24730 AT3G26410 AT3G27180 AT3G27750 AT3G28230 AT3G32940 AT3G43920 AT3G44150 AT3G44785 AT3G45180 AT3G45590 AT3G45750 AT3G46210 AT3G46630 AT3G46960 AT3G47120 AT3G48830 AT3G49180 AT3G49500 AT3G49640 AT3G50100 AT3G52210 AT3G52380 AT3G52905 AT3G53030 AT3G53500 AT3G53640 AT3G55170 AT3G55935 AT3G56120 AT3G56330 AT3G56510 AT3G57360 AT3G57430 AT3G57940 AT3G59810 AT3G60500 AT3G61240 AT3G61360 AT3G61620 AT3G61860 AT3G62310 AT3G62800 AT3G63070 AT3G63140 AT3G63370 AT3G63400 AT3G63490 AT3G63510 AT3G66652 AT4G00660 AT4G01037 AT4G01400 AT4G01560 AT4G01880 AT4G02400 AT4G02430 AT4G02720 AT4G02840 AT4G02990 AT4G03120 AT4G04940 AT4G05410 AT4G08580 AT4G10130 AT4G11970 AT4G12600 AT4G12640 AT4G14300 AT4G14510 AT4G14790 AT4G15520 AT4G16200 AT4G16680 AT4G17410 AT4G17610 AT4G17720 AT4G18465 AT4G18520 AT4G18750 AT4G20020 AT4G20030 AT4G21770 AT4G21900 AT4G22350 AT4G23540 AT4G24270 AT4G24500 AT4G25500 AT4G25550 AT4G26480 AT4G27000 AT4G27010 AT4G27490 AT4G28020 AT4G28200 AT4G28820 AT4G29820 AT4G31010 AT4G31200 AT4G32175 AT4G33360 AT4G33370 AT4G34140 AT4G34412 AT4G35370 AT4G36390 AT4G37120 AT4G38020 AT4G38160 AT4G38590 AT4G38780 AT4G40000 AT5G01230 AT5G01290 AT5G02610 AT5G02670 AT5G04050 AT5G04430 AT5G04600 AT5G05720 AT5G06420 AT5G08290 AT5G08420 AT5G08550 AT5G09210 AT5G09860 AT5G09920 AT5G10060 AT5G10070 AT5G10605 AT5G10620 AT5G10800 AT5G10910 AT5G11010 AT5G11200 AT5G12220 AT5G13010 AT5G13570 AT5G13680 AT5G14460 AT5G14600 AT5G15390 AT5G15810 AT5G16130 AT5G16140 AT5G16260 AT5G16750 AT5G16780 AT5G17660 AT5G18380 AT5G19210 AT5G19350 AT5G20170 AT5G20600 AT5G22100 AT5G22840 AT5G23080 AT5G23600 AT5G23690 AT5G24360 AT5G24840 AT5G25030 AT5G25060 AT5G25080 AT5G25340 AT5G26180 AT5G26742 AT5G27990 AT5G28210 AT5G28740 AT5G35400 AT5G36170 AT5G38600 AT5G38720 AT5G38890 AT5G39930 AT5G39980 AT5G40530 AT5G41190 AT5G41690 AT5G41770 AT5G42300 AT5G42310 AT5G42820 AT5G43720 AT5G44500 AT5G44780 AT5G46400 AT5G46920 AT5G47430 AT5G47680 AT5G47970 AT5G48240 AT5G48870 AT5G50250 AT5G51120 AT5G51140 AT5G51170 AT5G51280 AT5G51660 AT5G52040 AT5G52470 AT5G52490 AT5G54580 AT5G54910 AT5G55130 AT5G56130 AT5G56140 AT5G56900 AT5G57280 AT5G57370 AT5G58020 AT5G58040 AT5G59240 AT5G59460 AT5G60230 AT5G60870 AT5G60940 AT5G60990 AT5G61030 AT5G61140 AT5G61770 AT5G63120 AT5G63370 AT5G64200 AT5G64270 AT5G64390 AT5G64960 AT5G65900 AT5G67220"
1.17242992781602e-12,787,1796,1.25362358104312,"Organelle organization "," http://amigo.geneontology.org/amigo/term/GO:0006996","AT1G01690 AT1G01750 AT1G01910 AT1G02740 AT1G03000 AT1G03050 AT1G03770 AT1G03780 AT1G04030 AT1G04070 AT1G04200 AT1G04600 AT1G04750 AT1G04770 AT1G05520 AT1G06530 AT1G06590 AT1G06660 AT1G06670 AT1G06760 AT1G06820 AT1G06950 AT1G07500 AT1G07510 AT1G07745 AT1G07790 AT1G08390 AT1G08460 AT1G08560 AT1G08600 AT1G08620 AT1G08840 AT1G08880 AT1G09320 AT1G09580 AT1G10200 AT1G10390 AT1G10430 AT1G10865 AT1G10910 AT1G10940 AT1G11250 AT1G11750 AT1G11890 AT1G12150 AT1G12470 AT1G13160 AT1G13330 AT1G13790 AT1G13900 AT1G14010 AT1G14320 AT1G14450 AT1G14510 AT1G14686 AT1G14790 AT1G15215 AT1G15440 AT1G15880 AT1G16240 AT1G16740 AT1G16970 AT1G17260 AT1G17520 AT1G17530 AT1G17580 AT1G18190 AT1G18530 AT1G18540 AT1G20110 AT1G20260 AT1G20350 AT1G20750 AT1G20830 AT1G21190 AT1G21610 AT1G21700 AT1G22260 AT1G22620 AT1G22800 AT1G22860 AT1G24290 AT1G24310 AT1G24490 AT1G24764 AT1G26910 AT1G27390 AT1G27700 AT1G27880 AT1G28530 AT1G29430 AT1G30010 AT1G30475 AT1G30810 AT1G31470 AT1G31480 AT1G31780 AT1G31810 AT1G32270 AT1G32750 AT1G32990 AT1G36390 AT1G43860 AT1G45545 AT1G47750 AT1G48360 AT1G48635 AT1G48760 AT1G49970 AT1G50240 AT1G50400 AT1G50490 AT1G50710 AT1G50900 AT1G51060 AT1G52530 AT1G52740 AT1G52825 AT1G52930 AT1G53490 AT1G53530 AT1G54150 AT1G54230 AT1G54390 AT1G54690 AT1G56190 AT1G56380 AT1G58200 AT1G59560 AT1G59820 AT1G60430 AT1G60460 AT1G61030 AT1G61210 AT1G61570 AT1G61580 AT1G61780 AT1G62150 AT1G62490 AT1G62730 AT1G63540 AT1G63900 AT1G63990 AT1G64220 AT1G64740 AT1G64960 AT1G65010 AT1G65080 AT1G65950 AT1G66840 AT1G67360 AT1G67370 AT1G67440 AT1G68060 AT1G68590 AT1G69380 AT1G69390 AT1G69460 AT1G71440 AT1G71720 AT1G71790 AT1G72370 AT1G72740 AT1G72750 AT1G73100 AT1G73150 AT1G73790 AT1G74030 AT1G74050 AT1G74060 AT1G74120 AT1G74560 AT1G74730 AT1G75010 AT1G75640 AT1G75780 AT1G75840 AT1G75950 AT1G76860 AT1G77220 AT1G77300 AT1G77320 AT1G78770 AT1G78900 AT1G79090 AT1G79350 AT1G79560 AT1G79810 AT1G79850 AT1G79890 AT1G79950 AT1G80245 AT1G80270 AT1G80670 AT2G01110 AT2G01280 AT2G01470 AT2G01690 AT2G01730 AT2G01750 AT2G01920 AT2G02510 AT2G03050 AT2G03270 AT2G03290 AT2G03680 AT2G03820 AT2G04270 AT2G05210 AT2G07725 AT2G16365 AT2G16390 AT2G16780 AT2G16800 AT2G17560 AT2G17900 AT2G17940 AT2G18390 AT2G19080 AT2G19640 AT2G19670 AT2G19930 AT2G19950 AT2G20490 AT2G20616 AT2G20635 AT2G20890 AT2G20990 AT2G22040 AT2G22125 AT2G22740 AT2G23080 AT2G23140 AT2G23380 AT2G23740 AT2G24060 AT2G24070 AT2G25170 AT2G25625 AT2G25660 AT2G25870 AT2G25880 AT2G26230 AT2G26840 AT2G27460 AT2G27470 AT2G27600 AT2G28380 AT2G29530 AT2G29550 AT2G29560 AT2G30620 AT2G30820 AT2G30910 AT2G30950 AT2G31040 AT2G31200 AT2G31260 AT2G31300 AT2G31530 AT2G31840 AT2G31900 AT2G31970 AT2G32480 AT2G32590 AT2G32900 AT2G33240 AT2G33400 AT2G33460 AT2G33560 AT2G33640 AT2G33793 AT2G34050 AT2G34380 AT2G34560 AT2G34790 AT2G34860 AT2G35160 AT2G35790 AT2G36620 AT2G36650 AT2G37190 AT2G37270 AT2G37410 AT2G37620 AT2G38020 AT2G38140 AT2G38370 AT2G38440 AT2G38720 AT2G38810 AT2G39090 AT2G39290 AT2G39460 AT2G39725 AT2G39820 AT2G40010 AT2G40070 AT2G40430 AT2G40810 AT2G41350 AT2G42540 AT2G42740 AT2G43410 AT2G44150 AT2G44190 AT2G44690 AT2G44860 AT2G45500 AT2G45690 AT2G45700 AT2G45710 AT2G45740 AT2G45800 AT2G45810 AT2G45990 AT2G46020 AT2G46180 AT2G46225 AT2G46340 AT2G46455 AT2G47210 AT2G47690 AT2G47780 AT2G47940 AT2G47980 AT3G01015 AT3G01340 AT3G01450 AT3G02080 AT3G02380 AT3G02400 AT3G02680 AT3G02930 AT3G02980 AT3G03420 AT3G03490 AT3G03750 AT3G03800 AT3G03810 AT3G05310 AT3G05710 AT3G05740 AT3G05870 AT3G06320 AT3G07160 AT3G07525 AT3G07560 AT3G07610 AT3G07700 AT3G07740 AT3G07910 AT3G08010 AT3G09260 AT3G09480 AT3G09660 AT3G09700 AT3G09740 AT3G10140 AT3G10270 AT3G10390 AT3G10400 AT3G10420 AT3G10440 AT3G10525 AT3G10670 AT3G10780 AT3G11070 AT3G11250 AT3G11440 AT3G11820 AT3G12110 AT3G12280 AT3G12380 AT3G12530 AT3G12550 AT3G12780 AT3G12810 AT3G13672 AT3G13782 AT3G13870 AT3G14100 AT3G14120 AT3G14270 AT3G14980 AT3G15460 AT3G16010 AT3G16310 AT3G16320 AT3G16640 AT3G16730 AT3G18420 AT3G18730 AT3G18820 AT3G18870 AT3G19180 AT3G19210 AT3G19220 AT3G19590 AT3G20670 AT3G20740 AT3G20780 AT3G20898 AT3G21520 AT3G21820 AT3G22270 AT3G22980 AT3G22990 AT3G23990 AT3G24010 AT3G24320 AT3G24350 AT3G24495 AT3G24506 AT3G24560 AT3G24590 AT3G24870 AT3G24880 AT3G25120 AT3G25980 AT3G26680 AT3G27460 AT3G27530 AT3G27630 AT3G27730 AT3G27750 AT3G28730 AT3G33520 AT3G36659 AT3G44160 AT3G44490 AT3G44660 AT3G44750 AT3G45980 AT3G46030 AT3G46520 AT3G46560 AT3G46610 AT3G46630 AT3G46740 AT3G46950 AT3G47450 AT3G47460 AT3G48150 AT3G48470 AT3G48710 AT3G48870 AT3G49250 AT3G49500 AT3G50960 AT3G51520 AT3G51540 AT3G51880 AT3G52140 AT3G53020 AT3G53650 AT3G53760 AT3G54090 AT3G54710 AT3G54860 AT3G54990 AT3G55340 AT3G55480 AT3G56270 AT3G56290 AT3G56440 AT3G56480 AT3G56510 AT3G56910 AT3G56940 AT3G57060 AT3G57300 AT3G58160 AT3G59280 AT3G59960 AT3G60150 AT3G60190 AT3G60460 AT3G60740 AT3G60840 AT3G61070 AT3G61110 AT3G61230 AT3G61240 AT3G61320 AT3G61570 AT3G61650 AT3G61760 AT3G62080 AT3G62800 AT3G62880 AT3G62910 AT3G63060 AT3G63140 AT3G63190 AT3G63480 AT4G00630 AT4G00660 AT4G00680 AT4G01310 AT4G01370 AT4G01400 AT4G01800 AT4G02060 AT4G02195 AT4G03240 AT4G03260 AT4G03330 AT4G04980 AT4G05190 AT4G05360 AT4G08590 AT4G10790 AT4G11560 AT4G12620 AT4G13200 AT4G13570 AT4G14385 AT4G14790 AT4G14960 AT4G15770 AT4G15830 AT4G15890 AT4G16265 AT4G16310 AT4G16420 AT4G17220 AT4G17380 AT4G17730 AT4G18570 AT4G18600 AT4G18830 AT4G19020 AT4G19130 AT4G19360 AT4G19540 AT4G19650 AT4G20260 AT4G20400 AT4G20890 AT4G20900 AT4G21270 AT4G21530 AT4G21820 AT4G22150 AT4G22260 AT4G22880 AT4G23630 AT4G23940 AT4G25120 AT4G25190 AT4G25540 AT4G25590 AT4G26760 AT4G26780 AT4G26965 AT4G27370 AT4G27595 AT4G27990 AT4G28740 AT4G29350 AT4G29510 AT4G30690 AT4G30790 AT4G31010 AT4G31080 AT4G31120 AT4G31210 AT4G31430 AT4G31520 AT4G32190 AT4G32330 AT4G32820 AT4G32830 AT4G33460 AT4G33650 AT4G34020 AT4G34090 AT4G34412 AT4G34660 AT4G34740 AT4G35050 AT4G35520 AT4G35950 AT4G37210 AT4G38160 AT4G38360 AT4G38495 AT4G38510 AT4G38560 AT4G39690 AT4G39740 AT5G01280 AT5G02560 AT5G02570 AT5G02820 AT5G03030 AT5G03340 AT5G03470 AT5G03830 AT5G04130 AT5G04240 AT5G04320 AT5G04470 AT5G04850 AT5G04920 AT5G05200 AT5G05490 AT5G05510 AT5G05520 AT5G05560 AT5G05610 AT5G05620 AT5G05760 AT5G05970 AT5G06180 AT5G06310 AT5G06680 AT5G07170 AT5G07590 AT5G07660 AT5G07900 AT5G08020 AT5G08050 AT5G08390 AT5G08780 AT5G09260 AT5G10410 AT5G10470 AT5G10490 AT5G10710 AT5G10900 AT5G11340 AT5G11630 AT5G11770 AT5G12130 AT5G12150 AT5G12360 AT5G12390 AT5G13130 AT5G13770 AT5G13960 AT5G14300 AT5G15450 AT5G15510 AT5G15520 AT5G16460 AT5G16830 AT5G16850 AT5G16930 AT5G17290 AT5G17410 AT5G17550 AT5G17620 AT5G17690 AT5G18410 AT5G18580 AT5G18620 AT5G18700 AT5G19390 AT5G20490 AT5G20510 AT5G20610 AT5G20930 AT5G21920 AT5G22010 AT5G22330 AT5G22350 AT5G22370 AT5G22650 AT5G22750 AT5G22830 AT5G23120 AT5G24314 AT5G24330 AT5G24630 AT5G24650 AT5G25450 AT5G26040 AT5G26210 AT5G26742 AT5G26980 AT5G27280 AT5G27540 AT5G28690 AT5G36170 AT5G37630 AT5G38150 AT5G38510 AT5G38720 AT5G38880 AT5G39510 AT5G39770 AT5G39980 AT5G40450 AT5G40530 AT5G40820 AT5G41150 AT5G41360 AT5G41520 AT5G41685 AT5G42310 AT5G42480 AT5G43160 AT5G43500 AT5G43970 AT5G43990 AT5G44040 AT5G44140 AT5G44270 AT5G44280 AT5G44340 AT5G44635 AT5G45160 AT5G45400 AT5G46860 AT5G46920 AT5G47690 AT5G48030 AT5G49020 AT5G49540 AT5G49720 AT5G49880 AT5G50230 AT5G51020 AT5G51220 AT5G51230 AT5G51430 AT5G52220 AT5G52290 AT5G52650 AT5G53280 AT5G53430 AT5G53860 AT5G54180 AT5G54280 AT5G54600 AT5G54920 AT5G55200 AT5G55400 AT5G55580 AT5G55600 AT5G56180 AT5G56290 AT5G56580 AT5G57200 AT5G57320 AT5G57450 AT5G58140 AT5G58230 AT5G58270 AT5G58575 AT5G58650 AT5G58770 AT5G58780 AT5G58784 AT5G59890 AT5G59910 AT5G60870 AT5G60930 AT5G61000 AT5G61010 AT5G61140 AT5G61460 AT5G61500 AT5G61670 AT5G61770 AT5G61980 AT5G62050 AT5G62240 AT5G62250 AT5G62410 AT5G62440 AT5G62760 AT5G62810 AT5G63220 AT5G63540 AT5G63550 AT5G63880 AT5G63920 AT5G64400 AT5G64610 AT5G65274 AT5G66030 AT5G66410 AT5G67490 ATCG00840"
1.60362718427689e-10,399,848,1.34609526364422,"Establishment of protein localization "," http://amigo.geneontology.org/amigo/term/GO:0045184","AT1G01200 AT1G01910 AT1G01960 AT1G02130 AT1G02430 AT1G02620 AT1G03000 AT1G03380 AT1G03950 AT1G04070 AT1G04750 AT1G04760 AT1G05520 AT1G06210 AT1G06400 AT1G06950 AT1G07000 AT1G08400 AT1G08560 AT1G09270 AT1G09580 AT1G09630 AT1G10390 AT1G10730 AT1G11250 AT1G11890 AT1G11905 AT1G12360 AT1G12470 AT1G13160 AT1G13340 AT1G13900 AT1G14010 AT1G15880 AT1G16240 AT1G16920 AT1G17530 AT1G17730 AT1G19970 AT1G20110 AT1G20350 AT1G21170 AT1G21380 AT1G21650 AT1G22670 AT1G22860 AT1G23900 AT1G23935 AT1G24310 AT1G24490 AT1G25420 AT1G26170 AT1G27310 AT1G27390 AT1G27700 AT1G27970 AT1G28550 AT1G29330 AT1G30630 AT1G30890 AT1G31780 AT1G32270 AT1G32880 AT1G33040 AT1G33475 AT1G34220 AT1G35625 AT1G36390 AT1G48160 AT1G48440 AT1G48550 AT1G48635 AT1G48760 AT1G49300 AT1G50400 AT1G50500 AT1G50900 AT1G51640 AT1G51740 AT1G53530 AT1G54110 AT1G55540 AT1G59820 AT1G61030 AT1G61570 AT1G63540 AT1G63900 AT1G64220 AT1G65080 AT1G66080 AT1G67680 AT1G69460 AT1G71270 AT1G71300 AT1G72750 AT1G73030 AT1G73640 AT1G75340 AT1G75370 AT1G75850 AT1G76850 AT1G79280 AT1G79560 AT1G79810 AT1G79910 AT1G80670 AT1G80680 AT2G01110 AT2G01470 AT2G03290 AT2G03820 AT2G15290 AT2G16380 AT2G16640 AT2G17980 AT2G19080 AT2G19710 AT2G20440 AT2G20760 AT2G20790 AT2G20890 AT2G20990 AT2G21540 AT2G24020 AT2G24820 AT2G25660 AT2G27460 AT2G27600 AT2G29530 AT2G30695 AT2G31260 AT2G31530 AT2G32670 AT2G32900 AT2G33640 AT2G34940 AT2G36360 AT2G37290 AT2G37410 AT2G37680 AT2G38020 AT2G38410 AT2G39280 AT2G39380 AT2G40060 AT2G40810 AT2G41620 AT2G42700 AT2G43160 AT2G43490 AT2G43640 AT2G44100 AT2G44140 AT2G44610 AT2G45000 AT2G45790 AT2G45980 AT2G46455 AT2G47840 AT3G01340 AT3G01610 AT3G02460 AT3G03160 AT3G03490 AT3G03800 AT3G04970 AT3G05230 AT3G05710 AT3G05720 AT3G06540 AT3G07410 AT3G07560 AT3G07910 AT3G08530 AT3G08790 AT3G08960 AT3G09560 AT3G09700 AT3G09740 AT3G09800 AT3G09900 AT3G09910 AT3G10350 AT3G10780 AT3G11070 AT3G11730 AT3G11820 AT3G12160 AT3G12390 AT3G12400 AT3G14120 AT3G15060 AT3G15380 AT3G15580 AT3G15920 AT3G16100 AT3G16310 AT3G17780 AT3G18620 AT3G18820 AT3G20430 AT3G20920 AT3G22180 AT3G22950 AT3G24350 AT3G24890 AT3G25120 AT3G27530 AT3G44160 AT3G46560 AT3G46740 AT3G47810 AT3G48870 AT3G49100 AT3G49155 AT3G49470 AT3G50860 AT3G51310 AT3G51390 AT3G52850 AT3G53120 AT3G53610 AT3G54860 AT3G55480 AT3G55605 AT3G56190 AT3G56440 AT3G56450 AT3G56900 AT3G56920 AT3G57350 AT3G58170 AT3G59280 AT3G59290 AT3G59500 AT3G59950 AT3G60800 AT3G62290 AT3G62880 AT3G63130 AT4G00840 AT4G01800 AT4G02195 AT4G02510 AT4G03330 AT4G08320 AT4G10480 AT4G12760 AT4G15780 AT4G15810 AT4G17160 AT4G17170 AT4G17530 AT4G17730 AT4G19003 AT4G19490 AT4G20110 AT4G20140 AT4G20410 AT4G21160 AT4G21180 AT4G21560 AT4G21980 AT4G23460 AT4G23940 AT4G24550 AT4G24690 AT4G25650 AT4G26780 AT4G27040 AT4G27100 AT4G27690 AT4G27730 AT4G27840 AT4G29950 AT4G30790 AT4G30840 AT4G31480 AT4G31520 AT4G31540 AT4G31740 AT4G32150 AT4G32160 AT4G32350 AT4G32760 AT4G32910 AT4G33350 AT4G34580 AT4G35410 AT4G35450 AT4G35730 AT4G35860 AT4G38092 AT4G38490 AT4G38560 AT4G38790 AT4G39170 AT4G39180 AT4G39990 AT4G40042 AT5G01590 AT5G01760 AT5G03030 AT5G03070 AT5G03340 AT5G03520 AT5G03530 AT5G03940 AT5G04850 AT5G04920 AT5G05000 AT5G05010 AT5G05070 AT5G05520 AT5G05670 AT5G05680 AT5G05760 AT5G06120 AT5G07120 AT5G07880 AT5G08040 AT5G09260 AT5G09550 AT5G10260 AT5G11710 AT5G13850 AT5G13990 AT5G14670 AT5G16300 AT5G16830 AT5G16880 AT5G17290 AT5G17550 AT5G18525 AT5G20300 AT5G22360 AT5G22780 AT5G23550 AT5G24170 AT5G24390 AT5G24650 AT5G26980 AT5G27280 AT5G27430 AT5G28350 AT5G28750 AT5G39510 AT5G41060 AT5G41685 AT5G43970 AT5G45750 AT5G46630 AT5G46860 AT5G47200 AT5G47510 AT5G47520 AT5G47960 AT5G48660 AT5G49500 AT5G49830 AT5G49910 AT5G50230 AT5G51200 AT5G51430 AT5G52210 AT5G52340 AT5G52440 AT5G52580 AT5G52990 AT5G53520 AT5G53530 AT5G53570 AT5G55200 AT5G55500 AT5G55710 AT5G55930 AT5G56290 AT5G57210 AT5G58060 AT5G58180 AT5G58440 AT5G59150 AT5G59840 AT5G60730 AT5G60860 AT5G61010 AT5G61210 AT5G61500 AT5G62050 AT5G62810 AT5G63220 AT5G63640 AT5G63880 AT5G64410 AT5G65270 AT5G66160 AT5G66970 AT5G67560 ATCG00860"
2.16749477906857e-10,393,836,1.34488461567534,"Protein transport "," http://amigo.geneontology.org/amigo/term/GO:0015031","AT1G01200 AT1G01910 AT1G01960 AT1G02130 AT1G02430 AT1G02620 AT1G03000 AT1G03380 AT1G03950 AT1G04070 AT1G04750 AT1G04760 AT1G05520 AT1G06210 AT1G06400 AT1G06950 AT1G07000 AT1G08400 AT1G08560 AT1G09270 AT1G09580 AT1G09630 AT1G10390 AT1G10730 AT1G11250 AT1G11890 AT1G11905 AT1G12360 AT1G12470 AT1G13160 AT1G13340 AT1G13900 AT1G14010 AT1G15880 AT1G16240 AT1G16920 AT1G17530 AT1G17730 AT1G19970 AT1G20110 AT1G20350 AT1G21170 AT1G21380 AT1G21650 AT1G22670 AT1G22860 AT1G23900 AT1G23935 AT1G24310 AT1G25420 AT1G26170 AT1G27310 AT1G27390 AT1G27700 AT1G27970 AT1G28550 AT1G29330 AT1G30630 AT1G30890 AT1G31780 AT1G32270 AT1G32880 AT1G33040 AT1G33475 AT1G34220 AT1G35625 AT1G36390 AT1G48160 AT1G48440 AT1G48550 AT1G48635 AT1G48760 AT1G49300 AT1G50400 AT1G50500 AT1G50900 AT1G51640 AT1G51740 AT1G53530 AT1G54110 AT1G55540 AT1G59820 AT1G61570 AT1G63540 AT1G63900 AT1G64220 AT1G65080 AT1G66080 AT1G67680 AT1G69460 AT1G71270 AT1G71300 AT1G72750 AT1G73030 AT1G73640 AT1G75340 AT1G75370 AT1G75850 AT1G76850 AT1G79280 AT1G79560 AT1G79810 AT1G79910 AT1G80670 AT1G80680 AT2G01110 AT2G01470 AT2G03290 AT2G03820 AT2G15290 AT2G16380 AT2G16640 AT2G17980 AT2G19080 AT2G19710 AT2G20440 AT2G20760 AT2G20790 AT2G20890 AT2G20990 AT2G21540 AT2G24020 AT2G24820 AT2G25660 AT2G27460 AT2G27600 AT2G29530 AT2G30695 AT2G31260 AT2G31530 AT2G32670 AT2G32900 AT2G33640 AT2G34940 AT2G36360 AT2G37290 AT2G37410 AT2G37680 AT2G38020 AT2G38410 AT2G39280 AT2G39380 AT2G40060 AT2G40810 AT2G41620 AT2G42700 AT2G43160 AT2G43490 AT2G43640 AT2G44100 AT2G44140 AT2G44610 AT2G45000 AT2G45790 AT2G45980 AT2G46455 AT2G47840 AT3G01340 AT3G01610 AT3G02460 AT3G03160 AT3G03490 AT3G03800 AT3G04970 AT3G05230 AT3G05710 AT3G05720 AT3G06540 AT3G07410 AT3G07560 AT3G07910 AT3G08530 AT3G08790 AT3G08960 AT3G09560 AT3G09700 AT3G09740 AT3G09800 AT3G09900 AT3G09910 AT3G10350 AT3G10780 AT3G11070 AT3G11730 AT3G11820 AT3G12160 AT3G12390 AT3G12400 AT3G14120 AT3G15060 AT3G15380 AT3G15580 AT3G15920 AT3G16100 AT3G16310 AT3G17780 AT3G18620 AT3G18820 AT3G20430 AT3G20920 AT3G22180 AT3G22950 AT3G24350 AT3G24890 AT3G25120 AT3G27530 AT3G44160 AT3G46560 AT3G46740 AT3G47810 AT3G48870 AT3G49100 AT3G49470 AT3G50860 AT3G51310 AT3G51390 AT3G52850 AT3G53120 AT3G53610 AT3G54860 AT3G55480 AT3G55605 AT3G56190 AT3G56440 AT3G56450 AT3G56900 AT3G56920 AT3G57350 AT3G58170 AT3G59280 AT3G59290 AT3G59500 AT3G59950 AT3G60800 AT3G62290 AT3G62880 AT3G63130 AT4G00840 AT4G01800 AT4G02195 AT4G02510 AT4G03330 AT4G08320 AT4G10480 AT4G12760 AT4G15780 AT4G15810 AT4G17160 AT4G17170 AT4G17530 AT4G17730 AT4G19003 AT4G19490 AT4G20110 AT4G20410 AT4G21160 AT4G21180 AT4G21560 AT4G21980 AT4G23460 AT4G23940 AT4G24550 AT4G24690 AT4G25650 AT4G26780 AT4G27040 AT4G27100 AT4G27690 AT4G27730 AT4G27840 AT4G29950 AT4G30790 AT4G30840 AT4G31480 AT4G31520 AT4G31540 AT4G31740 AT4G32150 AT4G32160 AT4G32350 AT4G32760 AT4G32910 AT4G33350 AT4G34580 AT4G35410 AT4G35450 AT4G35730 AT4G35860 AT4G38092 AT4G38490 AT4G38790 AT4G39170 AT4G39180 AT4G39990 AT4G40042 AT5G01590 AT5G01760 AT5G03030 AT5G03070 AT5G03340 AT5G03520 AT5G03530 AT5G03940 AT5G04850 AT5G04920 AT5G05000 AT5G05010 AT5G05070 AT5G05520 AT5G05670 AT5G05680 AT5G05760 AT5G06120 AT5G07120 AT5G07880 AT5G08040 AT5G09260 AT5G09550 AT5G10260 AT5G11710 AT5G13850 AT5G13990 AT5G14670 AT5G16300 AT5G16830 AT5G16880 AT5G17290 AT5G17550 AT5G18525 AT5G20300 AT5G22360 AT5G22780 AT5G23550 AT5G24170 AT5G24390 AT5G24650 AT5G26980 AT5G27280 AT5G27430 AT5G28350 AT5G28750 AT5G39510 AT5G41060 AT5G41685 AT5G43970 AT5G45750 AT5G46630 AT5G46860 AT5G47200 AT5G47510 AT5G47520 AT5G47960 AT5G48660 AT5G49500 AT5G49830 AT5G49910 AT5G50230 AT5G51200 AT5G51430 AT5G52210 AT5G52340 AT5G52440 AT5G52580 AT5G52990 AT5G53520 AT5G53530 AT5G53570 AT5G55200 AT5G55500 AT5G55710 AT5G55930 AT5G56290 AT5G57210 AT5G58060 AT5G58180 AT5G58440 AT5G59150 AT5G59840 AT5G60730 AT5G60860 AT5G61010 AT5G61210 AT5G61500 AT5G62050 AT5G62810 AT5G63640 AT5G63880 AT5G64410 AT5G65270 AT5G66160 AT5G66970 AT5G67560 ATCG00860"
4.46183633554169e-10,259,516,1.43598140188022,"Ribonucleoprotein complex biogenesis "," http://amigo.geneontology.org/amigo/term/GO:0022613","AT1G01860 AT1G02870 AT1G03140 AT1G03360 AT1G03530 AT1G04080 AT1G04230 AT1G04635 AT1G04640 AT1G06560 AT1G07070 AT1G08360 AT1G08410 AT1G09150 AT1G10490 AT1G10840 AT1G12650 AT1G12780 AT1G13030 AT1G13160 AT1G14320 AT1G15420 AT1G15440 AT1G16280 AT1G16740 AT1G17130 AT1G18540 AT1G20580 AT1G22270 AT1G23280 AT1G26530 AT1G26550 AT1G26880 AT1G26910 AT1G29320 AT1G29430 AT1G29940 AT1G31970 AT1G32990 AT1G43860 AT1G48630 AT1G48830 AT1G48920 AT1G49970 AT1G50000 AT1G50920 AT1G52930 AT1G52980 AT1G55140 AT1G55150 AT1G56110 AT1G59760 AT1G60080 AT1G60230 AT1G61580 AT1G63180 AT1G63980 AT1G66260 AT1G66510 AT1G67440 AT1G69070 AT1G72080 AT1G72320 AT1G72370 AT1G74050 AT1G74060 AT1G74270 AT1G75660 AT1G76050 AT1G76300 AT1G77840 AT1G78190 AT1G78910 AT1G80070 AT1G80750 AT2G01640 AT2G03820 AT2G04270 AT2G06990 AT2G07725 AT2G09990 AT2G17510 AT2G18220 AT2G18720 AT2G20450 AT2G20490 AT2G25870 AT2G27750 AT2G31890 AT2G32050 AT2G32415 AT2G32600 AT2G34570 AT2G36620 AT2G37190 AT2G37270 AT2G37340 AT2G37990 AT2G39390 AT2G39460 AT2G39820 AT2G40010 AT2G40430 AT2G42270 AT2G42510 AT2G42650 AT2G42740 AT2G43190 AT2G43650 AT2G44860 AT2G45710 AT2G46230 AT2G46280 AT2G46290 AT2G47640 AT2G47990 AT2G48100 AT3G01160 AT3G01610 AT3G02080 AT3G02200 AT3G02560 AT3G03340 AT3G03920 AT3G03970 AT3G06320 AT3G07170 AT3G07590 AT3G07750 AT3G07920 AT3G09720 AT3G11250 AT3G12080 AT3G12860 AT3G12930 AT3G12990 AT3G13210 AT3G13580 AT3G13640 AT3G15080 AT3G15460 AT3G18610 AT3G19630 AT3G19800 AT3G19810 AT3G20420 AT3G22330 AT3G22510 AT3G22590 AT3G22660 AT3G22980 AT3G24506 AT3G28230 AT3G28900 AT3G46210 AT3G46630 AT3G49180 AT3G49990 AT3G52380 AT3G52905 AT3G53020 AT3G53030 AT3G55170 AT3G56160 AT3G56510 AT3G57290 AT3G57940 AT3G59810 AT3G60500 AT3G61110 AT3G61620 AT3G63140 AT3G63490 AT4G01310 AT4G01560 AT4G02400 AT4G02720 AT4G02840 AT4G03120 AT4G04940 AT4G05410 AT4G11420 AT4G12600 AT4G15770 AT4G17720 AT4G21770 AT4G22350 AT4G23540 AT4G25550 AT4G27010 AT4G27090 AT4G27490 AT4G28200 AT4G28820 AT4G30300 AT4G31420 AT4G31520 AT4G32175 AT4G35370 AT4G38780 AT5G02610 AT5G04600 AT5G05210 AT5G05680 AT5G06000 AT5G08420 AT5G09920 AT5G10070 AT5G10605 AT5G10620 AT5G10910 AT5G11010 AT5G11900 AT5G12220 AT5G13510 AT5G15520 AT5G16130 AT5G16750 AT5G16780 AT5G18380 AT5G18440 AT5G20600 AT5G20920 AT5G22100 AT5G22330 AT5G22840 AT5G25030 AT5G25080 AT5G26180 AT5G26742 AT5G27120 AT5G27640 AT5G27990 AT5G28740 AT5G38720 AT5G40530 AT5G41190 AT5G41520 AT5G41770 AT5G43720 AT5G44320 AT5G46400 AT5G48240 AT5G50250 AT5G51140 AT5G52470 AT5G52490 AT5G52650 AT5G54910 AT5G57280 AT5G59240 AT5G59460 AT5G60990 AT5G61770 AT5G63120 AT5G64270 AT5G65900 AT5G67510 ATCG00840"
