"Enrichment FDR","nGenes","Pathway Genes","Fold Enrichment","Pathway","URL","Genes"
0.0350156354584926,6,14,8.60297062750334,"G protein-coupled purinergic nucleotide receptor activity "," http://amigo.geneontology.org/amigo/term/GO:0045028"," GPR87  P2RY12  GPR34  P2RY14  GPR171  P2RY13"
0.0450158968392634,58,705,1.65144495260821,"G protein-coupled receptor activity "," http://amigo.geneontology.org/amigo/term/GO:0004930"," GPR18  OPRL1  NMBR  HTR2B  GPR87  LPAR6  GPR17  RGR  CCR1  F2RL2  GPR146  GPER1  OR1K1  ZNF219  P2RY12  GPR183  DRD5  FPR2  FPR1  OR13H1  PTGER4  GPR82  GPR34  CXCR6  OR9I1  CCR9  P2RY14  GPR171  OR51G2  OR51S1  OR2A4  OXTR  OR52E4  OR52N2  OR56B1  OR52N4  P2RY13  CCR3  CHRM5  SORCS2  FFAR4  OR9Q1  OR2C3  OR6N1  OR51A2  OR51A4  OR2H2  OR10C1  OR11A1  GABBR1  OR5V1  OR12D2  TAS2R38  NPBWR2  OR52E5  OR51G1  OR52R1  GPR22"
0.0450158968392634,3,3,20.0735981308411,"ADP-ribosylglutamate hydrolase activity "," http://amigo.geneontology.org/amigo/term/GO:0140293"," OARD1  MACROD1  MACROD2"
0.0698693764577823,6,20,6.02207943925234,"Purinergic nucleotide receptor activity "," http://amigo.geneontology.org/amigo/term/GO:0001614"," GPR87  P2RY12  GPR34  P2RY14  GPR171  P2RY13"
0.0698693764577823,6,20,6.02207943925234,"Nucleotide receptor activity "," http://amigo.geneontology.org/amigo/term/GO:0016502"," GPR87  P2RY12  GPR34  P2RY14  GPR171  P2RY13"
